ROMSB-ME,Romsdal Sparebank,Equity certificates,115.0,113.6,115.0,0,LP,225.94,,,,,,6440,Financial Services,,"Romsdal Sparebank operates as a savings bank that provides various financial products and services to retail and corporate customers primarily in Romsdal and southern parts of NordmÃ¸re. Its personal banking products and services include BSU and other savings accounts, fund savings plans, and retirement savings plans; bank cards and payment solutions; and mortgages, car and other vehicle loans, and small loans and refinancing. The company's business banking products and services comprise corporate accounts; financing solutions, such as bank guarantees, construction loans, overdrafts, leasing, and corporate loans; and savings and pension plans. It also offers debit and credit cards, payment solutions, Internet and mobile banking services, and insurance agency services. Romsdal Sparebank was formerly known as Bud FrÃ¦na og Hustad Sparebank and changed its name to Romsdal Sparebank in January 2018. The company was incorporated in 1971 and is based in ElnesvÃ¥gen, Norway with branch offices in Bud, EidsvÃ¥g, Farstad, and Molde, Norway.",Elnesvagen,47 71 26 80 00,Norway,[],http://romsdalsbanken.no,1.0,Torget 14,Financial Conglomerates,,115.0,114.9,110.68965,0.07200000000000001,0.0,,115.0,,81.0,,115.0,112.35293999999999,8.28,114.9,,81.0,,,,,,,,,114.9,2.0,NOK,23.594584,2850.0,,,,225940496.0,,,138.0,1.6619138,114.9,115.0,,,2850.0,119.0,,,,102.0,114.0,False,,,115.0,OSL,ROMSDAL SPAREBANK,Romsdal Sparebank,Europe/Oslo,CEST,False,7200000.0,EQUITY,ROMSB-ME.OL,finmb_32489035,no_market,,10.146,,0.29304,,inf,,,,1964700.0,,,373.64300000000003,,,,1577750400.0,,9576000.0,4.874,,,0.3077804,,1640908800.0,1585612800.0,,,,1379411456.0,,,,,,-0.124,,,,,,,,https://logo.clearbit.com/romsdalsbanken.no,47 71 26 80 01,,,,79804c60-17fd-3d3e-b5b5-988dd06cf2f5,,
SDSD,S.D. Standard Drilling,Energy,0.76,0.75,0.76,47,,437.78,0.0354,0.0188,-0.0026,-0.4370000000000001,-0.3719,3030,Energy,2.0,"S.D. Standard Drilling Plc operates the in oil and gas, and shipping sectors. It owns a 100% interest in four large-size platform supply vessels (PSVs); and a 26% interest in nine mid-size PSVs. The company was founded in 2010 and is headquartered in Limassol, Cyprus.",Limassol,357 2 5875474,Cyprus,[],http://www.standard-drilling.com,1.0,Panayides Building,Oil & Gas Equipment & Services,2nd floor Flat/Office 3 Chrysanthou Mylona 1,0.7340000000000001,0.74,0.884,0.0,0.0,,0.76,,228658.0,,0.7340000000000001,0.75405884,0.0,0.74,,228658.0,,,,,1446163200.0,0.728488,,,0.74,4.0,NOK,,334630.0,,,,437779744.0,,,955621.0,-84.350624,0.74,0.754,,246300.0,334630.0,1.41,38.0,,,0.68,0.7440000000000001,False,,1200000.0,0.76,OSL,S.D. STANDARD DRIL,S.D. Standard Drilling Plc,Europe/Oslo,CEST,False,7200000.0,EQUITY,SDSD.OL,finmb_117207561,no_market,,-80.312,,0.0,,-0.40081632,,0.02,,576025984.0,,,0.18600000000000003,,,,1577750400.0,0.20236999,-7025000.0,-0.012,,,4.0860214,0.68294996,1640908800.0,1585612800.0,,,284320673.0,416818080.0,,1493942400.0,1:3,,,,,,,,,,,https://logo.clearbit.com/standard-drilling.com,,,,,c402d990-30ec-3132-96d5-67784a88888a,,
SAGA,Saga Tankers,Financials,0.91,0.9,0.91,12,,240.87,-0.0321,-0.0216,-0.0812,-0.1586,-0.0071,0278,Industrials,6.0,"Saga Tankers ASA engages in the investment, management, and consultancy activities related to shipping, rig, real estate, stock trading, and other related businesses. It operates through Investments, Vallhall, and Other segment. The company invests in financial assets of long and short term; rents and operates vallhall facility; and offers professional services. Saga Tankers ASA was incorporated in 2010 and is headquartered in Oslo, Norway.",Oslo,47 23 01 49 14,Norway,[],http://www.sagatankers.no,1.0,Sjolystplass 2,Marine Shipping,,0.935,0.94,0.9152899,0.10695187,0.0,,0.94,,31680.0,,0.935,0.95617646,0.1,0.94,,31680.0,,,,0.1,1592352000.0,0.647093,,,0.905,4.0,NOK,,51730.0,,,,240865744.0,,,184532.0,4.397768,0.905,0.91,,607200.0,51730.0,1.25,,,,0.62,0.905,False,0.1087,1000000.0,0.94,OSL,SAGA TANKERS ASA,Saga Tankers ASA,Europe/Oslo,CEST,False,7200000.0,EQUITY,SAGA.OL,finmb_104481471,no_market,,3.8960000000000004,,-1.3173399,6.702999999999999,-0.10952377,,,,266150000.0,,,0.9420000000000001,,,,1577750400.0,0.06307,-72151000.0,-0.27399999999999997,,,0.96072185,0.84233004,1640908800.0,1585612800.0,,,28262451.0,213406096.0,,,,,,,,,,,,,,https://logo.clearbit.com/sagatankers.no,,,,,67fbca9a-e66f-3722-a9c2-d56fd1816a50,,
SALM,SalMar,Consumer staples,421.0,421.0,421.2,1613,,47540.52,-0.0106,-0.0073,-0.0355,-0.063,-0.0346,,,,,,,,,,,,,,,,,,,,,,,,,,,,,,,,,,,,,,,,,,,,,,,,,,,,,,,,,,,,,,,,,,,,,,,,,,,,,,,,,,,,,,,,,,,,,,,,,,,,,,,,,,,,,,,,,,,,,,,,,,,,,,,
SALMON,Salmones Camanchaca,Consumer staples,56.8,55.0,56.8,10,,3748.8,-0.0035,0.0143,0.0519,-0.1163,-0.1886,7550000,Consumer Defensive,1755.0,"Salmones Camanchaca S.A. engages in the salmon farming business in Chile. It offers fresh and frozen Atlantic and Pacific salmon in various formats, such as whole, fillet, portion, block, and harasu; and trout. The company operates under the Camanchaca Gourmet and Pier 33 brandsIt also exports its products to the United States, Russia, Brazil, China, Mexico, Japan, Argentina, and internationally. The company was founded in 2009 and is headquartered in Santiago, Chile. Salmones Camanchaca S.A. is a subsidiary of CompaÃ±Ã­a Pesquera Camanchaca S.A.",Santiago,56 22 363 5700,Chile,[],http://www.salmonescamanchaca.cl,1.0,Avenida El Golf NÂ° 99,Farm Products,Piso 10 Las Condes,57.0,57.2,61.326088,0.0044736844,0.7757,,58.6,,3763.0,,57.0,54.929413000000004,0.255,57.2,,3763.0,,,,2.63,1588636800.0,0.787929,,,56.8,2.0,NOK,122.413795,4640.0,,,,3776910336.0,,,1747.0,10.844435,56.8,57.0,,0.0,4640.0,75.0,,,,40.0,56.8,False,0.046,0.0,58.6,OSL,SALMONES CAMANCHAC,Salmones Camanchaca S.A.,Europe/Oslo,CEST,False,7200000.0,EQUITY,SALMON.OL,finmb_128615902,no_market,,11.034,,0.08799,55.676,-0.20833331,,,,66000000.0,,,3.042,,,,1577750400.0,0.32634997,30645000.0,0.46399999999999997,,,18.671926000000003,0.7438899999999999,1640908800.0,1585612800.0,,,19800000.0,3843053056.0,,,,,,-0.865,,,,,,,,https://logo.clearbit.com/salmonescamanchaca.cl,56 22 375 4384,,,,22f0e8a2-c696-3735-8edb-39400d62d7e2,,
SADG,Sandnes Sparebank,Equity certificates,58.6,58.6,59.0,18,,1225.93,-0.0034,0.0,0.0103,-0.0405,0.0045000000000000005,4306,Financial Services,133.0,"Sandnes Sparebank, an independent savings bank, provides a range of banking and investment products to retail and corporate customers in Norway. The company operates through three segments: Retail Market, Corporate Market, and Real Estate Agency. It offers fixed rate deposits, deposit accounts, BSU, escrow accounts for tax withholding, and other accounts; various loans and guarantees; and mobile and internet banking services. The company also provides real estate brokerage and general investment advisory services. Sandnes Sparebank was founded in 1875 and is headquartered in Sandnes, Norway.",Sandnes,47 51 67 67 00,Norway,[],http://www.sandnes-sparebank.no,1.0,Radhusgata 3,Banks—Regional,,58.8,58.2,61.18478399999999,0.08503401,0.6849,,59.0,,4440.0,,58.8,58.570586999999996,5.0,58.2,,4440.0,,,,5.0,1585699200.0,0.5156970000000001,,,58.2,2.0,NOK,7.952232400000001,3590.0,,,,1225929600.0,,,7867.0,2.147566,58.2,59.0,,150000.0,3590.0,78.0,9.718076,,,50.0,58.6,False,0.0847,100000.0,59.0,OSL,SANDNES SPAREBANK,Sandnes Sparebank,Europe/Oslo,CEST,False,7200000.0,EQUITY,SADG.OL,finmb_7009157,no_market,,17.932000000000002,,0.44356999999999996,,-0.07401574,,6.03,,20920300.0,,,130.786,,,,1577750400.0,0.25989,165028992.0,7.369,,,0.44806018,0.21443,1640908800.0,1585612800.0,,,10346965.0,10236360704.0,,,,,,-0.42200000000000004,,,,,,,,https://logo.clearbit.com/sandnes-sparebank.no,,,,,c56ac015-82e6-3bc7-8716-b1cd496f79ed,,
SAS NOK,SAS AB,Industrials,8.14,8.02,8.12,190,,3112.31,-0.0079,-0.0163,-0.1346,-0.4359,-0.3332,,,,,,,,,,,,,,,,,,,,,,,,,,,,,,,,,,,,,,,,,,,,,,,,,,,,,,,,,,,,,,,,,,,,,,,,,,,,,,,,,,,,,,,,,,,,,,,,,,,,,,,,,,,,,,,,,,,,,,,,,,,,,,,
SATS,SATS,Consumer discretionary,21.6,21.45,21.6,242,,3710.09,0.0093,0.1297,0.1429,-0.047400000000000005,,,,,,,,,,,,,,,,,,,,,,,,,,,,,,,,,,,,,,,,,,,,,,,,,,,,,,,,,,,,,,,,,,,,,,,,,,,,,,,,,,,,,,,,,,,,,,,,,,,,,,,,,,,,,,,,,,,,,,,,,,,,,,,,
SBANK,Sbanken,Financials,67.0,67.0,67.4,659,,7148.69,-0.0205,0.009000000000000001,0.093,-0.1019,-0.0577,,Financial Services,338.0,"Sbanken ASA, a digital bank, provides various banking products to retail customers in Norway. The company offers deposit products, such as security deposit accounts and home savings account; and home loans, car loans, credit cards, overdraft facilities, personal loans, consumer loans, and custody account loans, as well as short-term loans. It also provides payment services, including payment of bills, international payments, invoice payments, card transactions, etc.; log-in, security solutions, etc.; and investment products, as well as online banking services. The company was formerly known as Skandiabanken ASA and changed its name to Sbanken ASA in November 2017. Sbanken ASA was founded in 2000 and is headquartered in Bergen, Norway.",Bergen,47 55 26 00 00,Norway,[],http://sbanken.no,1.0,Folke Bernadottesvei 38,Banks—Regional,,68.4,67.7,61.03804399999999,0.025584795,0.2722,,68.9,,79608.0,,68.4,64.66765,1.75,67.7,,79608.0,,,,,1587945600.0,1.097117,,,66.5,2.0,NOK,10.312451,134865.0,,,,7160223232.0,,,149603.0,4.196278599999999,66.5,67.4,,0.0,134865.0,77.6,9.190672,,,38.5,69.0,False,,0.0,68.9,OSL,SBANKEN ASA,Sbanken ASA,Europe/Oslo,CEST,False,7200000.0,EQUITY,SBANK.OL,finmb_215678890,no_market,,14.110999999999999,,0.4069,,-0.036619723,,7.29,,106869000.0,,,69.237,,,,1577750400.0,0.8619600000000001,694308992.0,6.497000000000001,,,0.9676906999999999,0.0,1640908800.0,1593475200.0,,,78567128.0,24078186496.0,,,,,,0.048,,,,,,,,https://logo.clearbit.com/sbanken.no,,,,,d2bc4800-932a-3817-b298-6e2d130d91bc,,
SCANA,Scana,Materials,1.06,1.05,1.06,57,,113.96,-0.0275,-0.094,0.2254,0.325,0.3168,4004,Basic Materials,,"Scana ASA, an industrial investment company, operates in the steel, valve control, offshore, property, and other businesses in Norway, South Korea, Sweden, China, the United States, Poland, Brazil, and Singapore. The company offers products, such as riser components for field development in very deep water. It also owns, develops, and manages properties. The company manages approximately 10,000 square meters of buildings, including smaller office buildings; manages properties and acreage in JÃ¸rpeland in Strand, east of Stavanger consisting of vacant land lots approximately 500 acres in size, as well as a cottage area that consists of approximately 20 plots near Liarvatn, northeast of JÃ¸rpeland; and owns and leases approximately 9,000 square meters of buildings in Volda primarily used for industry. In addition, it offers system solutions for offloading, mooring, turrets, and swivels for floating production and storage vessels; and hydraulic and pneumatic valve control systems for the oil, gas, and shipbuilding industries, including control panels, solenoid switches, hydraulic oil units, and/or PC/PLS-based systems for control and indication. The company was formerly known as Incus Investor ASA and changed its name to Scana ASA in May 2020. Scana ASA is based in Stavanger, Norway.",Stavanger,47 51 86 94 00,Norway,[],http://www.scana.no,1.0,Strandkaien 2,Steel,PO Box 878,1.09,1.05,0.85947764,,0.0,,1.12,,649404.0,,1.09,0.99735296,,1.05,,649404.0,,,,,1272499200.0,1.072674,,,1.05,4.0,NOK,529.99994,367017.0,,,,113955296.0,,,783472.0,0.31731020000000004,1.05,1.06,,,367017.0,1.78,,,,0.5,1.05,False,,,1.12,OSL,SCANA ASA,Scana ASA,Europe/Oslo,CEST,False,7200000.0,EQUITY,SCANA.OL,finmb_881976,no_market,,0.544,,0.0007700000000000001,62.56,0.19125688,,,,107505000.0,,,0.149,,,,1577750400.0,0.0,-4700000.0,0.002,,,7.1140933,0.76848,1640908800.0,1585612800.0,,,39910371.0,195187392.0,,,,,,,,,,,,,,https://logo.clearbit.com/scana.no,47 51 91 99 80,,,,ea4c4847-296a-3d05-bde1-f6159291020f,,
SSO,Scatec Solar,Utilities,169.4,168.7,169.4,2918,,23318.98,0.0412,0.0561,0.1021,0.365,0.8676999999999999,,,,,,,,,,,,,,,,,,,,,,,,,,,,,,,,,,,,,,,,,,,,,,,,,,,,,,,,,,,,,,,,,,,,,,,,,,,,,,,,,,,,,,,,,,,,,,,,,,,,,,,,,,,,,,,,,,,,,,,,,,,,,,,
SCHA,Schibsted ser. A,Communication services,328.1,330.4,346.7,7190,,34273.31,,0.3114,0.2836,0.2367,0.4328,0105,Communication Services,5006.0,"Schibsted ASA, together with its subsidiaries, operates as a media company. The company operates through Marketplaces, Publishing, and Growth segments. It operates online marketplaces that connect buyers and sellers; offers online classifieds services; and publishes printed and online newspapers, and subscription-based newspapers. The company is also involved in printing and distribution, as well as online consumer finance and price comparison activities. It operates in Norway, Sweden, France, Spain, other European countries, and internationally. The company was founded in 1839 and is headquartered in Oslo, Norway.",Oslo,47 23 10 66 00,Norway,[],http://www.schibsted.com,1.0,Akersgata 55,Publishing,Sentrum PO Box 490,286.7,350.0,241.44782999999998,0.0069759325,1.0989,,353.5,,239411.0,,286.7,254.47647,2.0,350.0,,239411.0,,,,,1588809600.0,0.8116270000000001,,,323.8,2.0,NOK,125.75981999999999,525784.0,,,,75145781248.0,,,213849.0,3.9211949999999995,323.8,328.7,,121500.0,525784.0,353.5,39.637848,,,170.0,328.8,False,,7700.0,353.5,OSL,SCHIBSTED ASA,Schibsted ASA,Europe/Oslo,CEST,False,7200000.0,EQUITY,SCHA.OL,finmb_878146,no_market,,4.11,,0.03313,29.98,0.24543881,,8.56,,104460000.0,,,45.603,,,,1577750400.0,0.52269,635000000.0,2.698,,,7.440299499999999,0.30409,1640908800.0,1593475200.0,,,165843552.0,78756937728.0,,,,,,0.738,,,,,,,,https://logo.clearbit.com/schibsted.com,47 23 10 66 01,,,,,,
SCHB,Schibsted ser. B,Communication services,296.8,270.0,309.8,2553,,38384.41,,0.3075,0.2727,0.1787,0.3553,0105,Communication Services,5006.0,"Schibsted ASA, together with its subsidiaries, operates as a media company. The company operates through Marketplaces, Publishing, and Growth segments. It operates online marketplaces that connect buyers and sellers; offers online classifieds services; and publishes printed and online newspapers, and subscription-based newspapers. The company is also involved in printing and distribution, as well as online consumer finance and price comparison activities. It operates in Norway, Sweden, France, Spain, other European countries, and internationally. The company was founded in 1839 and is headquartered in Oslo, Norway.",Oslo,47 23 10 66 00,Norway,[],http://www.schibsted.com,1.0,Akersgata 55,Publishing,Sentrum PO Box 490,259.4,314.0,227.04637000000002,0.0077101006,1.0989,,329.8,,93178.0,,259.4,234.24706,2.0,314.0,,93178.0,,,,,1557100800.0,0.8116270000000001,,,294.2,2.0,NOK,114.899925,449264.0,,,,75882110976.0,,,113944.0,3.9596176,294.2,298.8,,19800.0,449264.0,329.8,,,,164.4,297.2,False,,49700.0,329.8,OSL,SCHIBSTED ASA,Schibsted ASA,Europe/Oslo,CEST,False,7200000.0,EQUITY,SCHB.OL,finmb_878146,no_market,,3.7760000000000002,,0.03313,27.545,0.17588389,,,,129328000.0,,,45.603,,,,1577750400.0,0.49286997,635000000.0,2.698,,,6.797797999999999,0.26550999999999997,1640908800.0,1593475200.0,,,165843552.0,72359772160.0,,,,,,0.738,,,,,,,,https://logo.clearbit.com/schibsted.com,47 23 10 66 01,,,,b1a894a0-8db7-323e-bced-65ce26c26d75,,
SBX,SeaBird Exploration,Energy,4.49,4.36,4.49,47,LP,120.86,-0.0011,-0.06559999999999999,-0.0355,-0.6031,-0.7884,4001,Energy,460.0,"SeaBird Exploration Plc, through its subsidiaries, provides marine 2D and 3D seismic data for the oil and gas industry in Europe, Africa, the Middle East, North and South America, and the Asia Pacific. The company offers 2D seismic, and 3D and 3D shallow water acquisition services; and operates source vessels that provide conventional undershoot, 4D repeat survey, wide azimuth, push reverse, long term charter and vessel management, and spot charter services. As of December 31, 2019, it had an active fleet of 6 vessels. The company was incorporated in 2000 and is headquartered in Limassol, Cyprus.",Limassol,,Cyprus,[],http://www.sbexp.com,1.0,Matrix Tower II,Oil & Gas Equipment & Services,Spyrou Kyprianou 15,4.49,4.415,1.6328014,,0.0,,4.485,,60083.0,,4.49,4.5987144,,4.415,,60083.0,,,,,,2.865116,,,4.35,4.0,NOK,,123456.0,,,,120846088.0,,,2091125.0,2.077607,4.35,4.49,,,123456.0,5.35,,,,0.17600000000000002,4.36,False,,,4.485,OSL,SEABIRD EXPL PLC,SeaBird Exploration Plc,Europe/Oslo,CEST,False,7200000.0,EQUITY,SBX.OL,finmb_26654204,no_market,,2.101,,-0.39963000000000004,-21.814,3.1192656000000003,,,,26944500.0,,,1.7369999999999999,,,,1577750400.0,0.060829999999999995,-23245000.0,-0.863,,,2.5820382,0.28686002,1640908800.0,1585612800.0,,,21850434.0,122221096.0,,1591228800.0,1:20,,,,,,,,,,,https://logo.clearbit.com/sbexp.com,,,,,8ccc4807-977c-304d-b7ae-dfeb13660bc6,,
SDRL,Seadrill,Energy,3.76,3.76,3.78,162,,375.54,0.0404,0.029,-0.3387,-0.8168000000000001,-0.8847,HM 08,Energy,4538.0,"Seadrill Limited, an offshore drilling contractor, provides offshore drilling services to the oil and gas industry worldwide. It operates in three segments: Floaters, Jack-up Rigs, and Other. The Floaters segment offers drilling, completion, and maintenance services for offshore exploration and production wells. Its drilling contracts relates to semi-submersible rigs and drill ships for harsh and benign environments in mid, deep, and ultra-deep waters. The Jack-up Rigs segment provides drilling, completion, and maintenance services for offshore exploration and production wells. Its drilling contracts relate to jack-up rigs for operations in harsh and benign environment in shallow waters. The Other segment offers management services to third parties and related parties. The company operates a fleet of 35 drilling units, including 7 drill ships, 12 semi-submersible rigs, and 16 jack-up rigs. It serves oil super-majors, state-owned national oil companies, and independent oil and gas companies. Seadrill Limited was founded in 2005 and is based in Hamilton, Bermuda.",Hamilton,441 295 6935,Bermuda,[],http://www.seadrill.com,1.0,Par-la-Ville Place,Oil & Gas Drilling,4th Floor 14 Par-la-Ville Road,3.61,3.7,7.9467897,,0.0,,3.7939999999999996,,447826.0,,3.61,4.4638233,,3.7,,447826.0,,,,,,2.958295,,,3.6,4.0,NOK,,472926.0,,,,359221600.0,,,1273931.0,0.3181768,3.6,3.78,,,472926.0,39.9,,,,2.95,3.78,False,,,3.7939999999999996,OSL,SEADRILL LTD,Seadrill Limited,Europe/Oslo,CEST,False,7200000.0,EQUITY,SDRL.OL,finmb_22532593,no_market,,5.655,,-2.2037199,30.401,-0.89351034,,-6.6,,100330000.0,,,-0.528,,,,1577750400.0,0.37392,-2488000000.0,-24.88,,,,0.27479000000000003,1640908800.0,1585612800.0,,,69439318.0,6384190976.0,,,,,,,,,,,,,,https://logo.clearbit.com/seadrill.com,441 295 3494,,,,f34cf53e-3abd-370d-b16d-49b3354d00b7,,
SSG,Self Storage Group,Industrials,24.6,24.6,25.0,31,,2074.48,0.008199999999999999,0.0123,-0.0646,-0.1307,0.2,278,Industrials,66.0,"Self Storage Group ASA engages in the rental of self-storage units to private individuals and businesses in Norway, Sweden, and Denmark. The company operates through OK Minilager, City Self-Storage, and Property segments. It operates climate controlled storage units and container based storage units. The company also retails storage ancillary goods, such as boxes, tapes, and bubble-wraps; distributes insurance products; and invests in real estate properties. As of July 2, 2020, it operated 113 facilities with a total lettable area of 140,300 square meters across Scandinavia. The company was founded in 1993 and is headquartered in Oslo, Norway.",Oslo,47 92 42 94 38,Norway,[],http://www.selfstoragegroup.no,1.0,Karenslyst AllE 2,Specialty Business Services,,24.4,24.4,26.000725,,0.0,,24.7,,28099.0,,24.4,25.388235,,24.4,,28099.0,,,,,,0.9354370000000001,,,24.2,2.0,NOK,29.638556,11381.0,,,,2074483584.0,,,31343.0,7.526252700000001,24.2,24.8,,0.0,11381.0,33.0,27.954546,,,19.0,24.6,False,,0.0,24.7,OSL,SELF STORAGE GROUP,Self Storage Group ASA,Europe/Oslo,CEST,False,7200000.0,EQUITY,SSG.OL,finmb_540146654,no_market,,10.413,,0.23823000000000003,17.685,,,0.88,,84328600.0,,,12.686,,,,1577750400.0,0.52766997,65665000.0,0.83,,,1.9391456000000002,0.46776,1640908800.0,1585612800.0,,,39348561.0,2870088448.0,,,,,,0.371,,,,,,,,https://logo.clearbit.com/selfstoragegroup.no,,,,,c6cbba01-08d5-33e4-af37-a0c8cde4dcfd,,
SBO,Selvaag Bolig,Real estate,51.7,51.5,51.7,585,,4822.62,0.0098,-0.0208,0.0098,0.0152,0.6574,0380,Real Estate,87.0,"Selvaag Bolig ASA, a housing development company, engages in the development, construction, and sale of residential properties in Greater Oslo, Bergen, Stavanger, Trondheim, and Stockholm. The company offers its properties under the Start, Home, and Pluss brands. The company was founded in 2008 and is headquartered in Oslo, Norway. Selvaag Bolig ASA is a subsidiary of Selvaag AS.",Oslo,47 23 13 70 00,Norway,[],http://www.selvaagboligasa.no,1.0,Silurveien 2,Real Estate Services,,51.2,51.4,52.973553,0.068359375,0.2334,,52.1,,42615.0,,51.2,51.286766,3.5,51.4,,42615.0,,,,3.0,1587945600.0,0.594186,,,50.4,2.0,NOK,2.6590545,70267.0,,,,4822622208.0,,,86632.0,1.402526,50.4,51.6,,199000.0,70267.0,77.0,10.5725975,,6.8,38.95,51.1,False,0.056900002000000005,2400.0,52.1,OSL,SELVAAG BOLIG AS,Selvaag Bolig ASA,Europe/Oslo,CEST,False,7200000.0,EQUITY,SBO.OL,finmb_104553470,no_market,,1.9180000000000001,,0.52312,3.517,0.08016872400000001,,4.89,,93280896.0,,,26.229,,,,1577750400.0,0.21912001,1798752000.0,19.442999999999998,,,1.9711006999999998,0.57431,1640908800.0,1585612800.0,,,38860252.0,6595830272.0,,,,,,,,,,,,,,https://logo.clearbit.com/selvaagboligasa.no,,,,,a7d9d772-1147-377d-a6d7-d4a6ebbfa4eb,,
SHLF,Shelf Drilling,Energy,3.83,3.78,3.83,254,,521.58,0.0912,0.3439,0.0,-0.7848,-0.8617,,Energy,2160.0,"Shelf Drilling, Ltd., through its subsidiaries, operates as a shallow water offshore drilling contractor in the Middle East, North Africa, the Mediterranean, South East Asia, India, and West Africa. It provides equipment and services for the drilling, completion, and well maintenance of shallow water offshore oil and natural gas wells. The company serves government owned or controlled energy companies, and integrated oil companies or independent exploration and production companies. As of December 31, 2019, it owned 32 independent-leg cantilever jack-up rigs. The company was founded in 2012 and is headquartered in Dubai, the United Arab Emirates.",Dubai,971 4 567 3400,United Arab Emirates,[],http://www.shelfdrilling.com,1.0,One JLT,Oil & Gas Drilling,Floor 12 Jumeirah Lakes Towers PO Box 212201,3.51,3.6,9.644928,,0.0,,3.84,,446553.0,,3.51,3.3585293,,3.6,,446553.0,,,,,,1.363685,,,3.55,4.0,NOK,,994276.0,,,,521577056.0,,,966969.0,0.8546464,3.55,3.78,,0.0,994276.0,28.5,-8.326087,,,2.74,3.78,False,,0.0,3.84,OSL,SHELF DRILLING LTD,"Shelf Drilling, Ltd.",Europe/Oslo,CEST,False,7200000.0,EQUITY,SHLF.OL,finmb_264429554,no_market,,2.385,,-0.52572,13.232000000000001,-0.8755318999999999,,-0.46,,136182000.0,,,2.7569999999999997,,,,1577750400.0,0.61056,-320836000.0,-2.383,,,1.3891912,0.19802,1640908800.0,1585612800.0,,,78989858.0,1455606144.0,,,,,,,,,,,,,,https://logo.clearbit.com/shelfdrilling.com,971 4 567 3401,,,,251b3927-5ac6-3469-b7d9-67c98b0169c8,,
SIOFF,Siem Offshore,Energy,0.92,0.9,0.92,4,,859.96,0.0222,-0.0108,-0.0316,-0.2698,-0.3907,4610,Energy,1102.0,"Siem Offshore Inc., together with its subsidiaries, owns and operates offshore support vessels for the offshore energy service industry. It operates platform supply vessels (PSVs); offshore subsea construction vessels (OSCVs); anchor-handling tug supply vessels (AHTS vessels); other vessels, including fast crew, fast supply, and oil spill recovery vessels; and scientific core-drilling and others. As of March 31, 2020, it had a fleet of 33 vessels, which included seven PSVs, four OSCVs, ten AHTS vessels, two well-intervention vessels, one scientific core-drilling vessel, five Brazilian flagged vessels, and three Canadian flagged vessels comprising AHTS vessels and PSVs. It operates in Norway, North Sea, the Arctic Ocean, Northern Pacific Ocean, West Africa, Australia, South East Asia, Canada, and Brazil. The company was founded in 2005 and is headquartered in Kristiansand, Norway. Siem Offshore Inc. is a subsidiary of Siem Europe S.a r.l.",Kristiansand,47 38 60 04 00,Norway,[],http://www.siemoffshore.com,1.0,Nodeviga 14,Oil & Gas Midstream,,0.9,0.905,1.0046377,,0.0,,0.92,,141075.0,,0.9,0.99558824,,0.905,,141075.0,,,,,1399334400.0,0.757558,,,0.905,4.0,NOK,,5100.0,,,,859959872.0,,,94165.0,3.1162822,0.905,0.92,,137000.0,5100.0,2.0,-46.0,,,0.6,0.9,False,,132200.0,0.92,OSL,SIEM OFFSHORE INC,Siem Offshore Inc.,Europe/Oslo,CEST,False,7200000.0,EQUITY,SIOFF.OL,finmb_23954324,no_market,,6.568,,-0.31768,19.891,-0.41176468,,-0.02,,934739008.0,,,0.335,,,,1577750400.0,0.00196,-92925000.0,-0.09300000000000001,,,2.7462687000000003,0.97419,1640908800.0,1585612800.0,,,32183056.0,1812381952.0,,,,,,,,,,,,,,https://logo.clearbit.com/siemoffshore.com,47 37 40 62 86,,,,a3c28fbe-b1c0-3929-ae8a-638a1b89f2da,,
