EQNR,Equinor,Energy,138.65,138.6,138.65,7257,,446642.41,0.021,0.0007000000000000001,0.0084,-0.1814,-0.0455,4035,Energy,21412.0,"Equinor ASA, an energy company, explores for, produces, transports, refines, and markets petroleum and petroleum-derived products, and other forms of energy in Norway and internationally. The company operates through Development & Production Norway; Development & Production Brazil; Development & Production International; Marketing, Midstream & Processing; New Energy Solutions; Technology, Projects & Drilling; Exploration; and Global Strategy & Business Development segments. It also transports, processes, manufactures, markets, and trades in oil and gas commodities, such as crude and condensate products, gas liquids, natural gas, and liquefied natural gas; markets and trades in electricity and emission rights; and operates refineries, processing and power plants, and terminals. In addition, the company develops wind, and carbon capture and storage projects, as well as offers other renewable energy and low-carbon energy solutions. As of December 31, 2019, it had proved oil and gas reserves of 6,004 million barrels of oil equivalent. The company was formerly known as Statoil ASA and changed its name to Equinor ASA in May 2018. Equinor ASA was founded in 1972 and is headquartered in Stavanger, Norway.",Stavanger,47 51 99 00 00,Norway,[],http://www.equinor.com,1.0,Forusbeen 50,Oil & Gas Integrated,135.8,136.95,142.29408,0.005228277,,,138.65,,3344947.0,,135.8,139.80736000000002,0.71,136.95,,3344947.0,,,,3.3,1597363200.0,0.733139,,,136.65,2.0,NOK,3623942.0,,,,450347663360.0,,,4181102.0,8.62223,136.65,138.1,,0.0,3623942.0,187.2,62.174884999999996,,4.95,95.2,138.05,False,0.024600001,0.0,138.65,OSL,EQUINOR ASA,Equinor ASA,Europe/Oslo,CEST,False,7200000.0,EQUITY,EQNR.OL,finmb_989228,no_market,,8.863999999999999,,-0.04413,32.251,-0.11118466,,,,3248090112.0,,,10.863,,,,1577750400.0,0.19812000000000002,-2304999936.0,-0.6970000000000001,,0.14325917,12.763508999999999,0.67271006,1640908800.0,1593475200.0,,,1016182440.0,462994800640.0,,1147219200.0,5:1,,,,,,,,,,,https://logo.clearbit.com/equinor.com,,,,,,,,
EPR,Europris,Consumer discretionary,43.0,43.0,43.1,784,,7130.2,-0.0218,-0.041900000000000014,-0.0974,0.3124,0.8097,1661,Consumer Defensive,1814.0,"Europris ASA operates as a discount variety retailer in Norway. The company sells own brand, private-label, and branded merchandise, including personal care, animal, home and interior, leisure time, clothes and shoes, fix home, household, garn, and enterprise assortment products. As of March 26, 2020, it operated 265 stores. The company was formerly known as EPH II AS and changed its name to Europris ASA in May 2015. The company was founded in 2011 and is headquartered in RolvsÃ¸y, Norway.",Rolvsoy,,Norway,[],http://www.europris.no,1.0,Dikeveien 57,Discount Stores,43.96,43.96,37.4071,0.04435851,0.58669996,,44.0,,376897.0,,43.96,45.84353,1.95,43.96,,376897.0,,,,1.95,1588204800.0,0.794767,,,42.84,2.0,NOK,339346.0,,,,7130217472.0,,,722238.0,1.0231626,42.84,43.06,,79600.0,339346.0,50.75,16.602318,,,23.6,42.98,False,0.0438,95300.0,44.0,OSL,EUROPRIS ASA,Europris ASA,Europe/Oslo,CEST,False,7200000.0,EQUITY,EPR.OL,finmb_293420901,no_market,,1.538,,0.078049995,12.027999999999999,0.7511810999999999,,2.59,,165819008.0,,,11.468,,,,1577750400.0,0.53228,543936000.0,3.28,,0.14325917,3.749564,0.03046,1640908800.0,1593475200.0,,,159459440.0,10715483136.0,,,,,,1.399,,,,,,,,https://logo.clearbit.com/europris.no,,13.109755999999999,,,,,,
EXTX-ME,EXACT Therapeutics,Health care,39.0,37.5,39.0,3,,1168.74,0.0,-0.016399999999999998,,,,0379,Healthcare,4.0,"EXACT Therapeutics AS, a clinical stage biotech company, develops a technology platform for targeted therapeutic enhancement, Acoustic Cluster Therapy (ACT). The ACT sonoporation is an approach to ultrasound-mediated, targeted drug enhancement with the potential to amplify the clinical utility of a range of therapeutic agents across various indications, including within oncology (chemotherapy and immunotherapy), infectious diseases, and neurological conditions. The company was founded in 2012 and is based in Oslo, Norway.",Oslo,,Norway,[],http://www.phoenixsolutions.no,1.0,Ullernchausseen 64,Biotechnology,39.0,40.0,,,0.0,,40.0,,,,39.0,,,40.0,,,,,,,,,,,39.0,2.0,NOK,116.0,,,,1168744192.0,,,,157.34415,39.0,39.0,,,116.0,40.0,,,,39.0,37.505,False,,,40.0,OSL,EXACT THERAPEUTICS,Phoenix Solutions AS,Europe/Oslo,CEST,False,7200000.0,EQUITY,EXTX-ME.OL,finmb_582869177,no_market,,153.309,,-2.0169599999999996,-72.554,,,,,29967800.0,,,1.4040000000000001,,,,1577750400.0,,-14981884.0,-0.5,,0.14325917,27.777777,,1640908800.0,,,,29885039.0,1138774528.0,,,,,,,,,,,,,,https://logo.clearbit.com/phoenixsolutions.no,,,,,,,,
FJORD,Fjord1,Industrials,44.5,44.2,44.6,11,,4445.25,-0.0067,-0.0177,-0.0177,0.2158,0.1589,6900,Industrials,1056.0,"Fjord1 ASA, together with its subsidiaries, operates passenger ferries and other passenger boats in Norway. The company operates in four segments: Ferry, Passenger Boat, Catering, and Tourism. The company's ferries and passenger boats transport vehicles and passengers. It also offers catering and tourism, shipyard, and travel agency services; and manages properties. The company was founded in 2001 and is headquartered in FlorÃ¸, Norway. Fjord1 ASA is a subsidiary of Havilafjord AS.",Floro,47 57 75 70 00,Norway,[],http://www.fjord1.no,1.0,Strandavegen 15,Marine Shipping,44.8,44.8,41.580290000000005,0.06026786,1.6071,,44.8,,6908.0,,44.8,44.95,2.7,44.8,,6908.0,,,,,1557878400.0,0.860991,,,44.1,2.0,NOK,5213.0,,,,4445977088.0,,,28943.0,1.5887858,44.1,44.6,,0.0,5213.0,46.9,12.678061999999999,,,31.0,44.2,False,,0.0,44.8,OSL,FJORD1 ASA,Fjord1 ASA,Europe/Oslo,CEST,False,7200000.0,EQUITY,FJORD.OL,finmb_22655336,no_market,,3.7039999999999997,,0.059789999999999996,13.305,0.19210529999999998,,3.51,,99909600.0,,,22.394000000000002,,,,1577750400.0,0.11310001,167319008.0,1.675,,0.14325917,1.9871395,0.85439,1640908800.0,1585612800.0,,,14464912.0,10366352384.0,,,,,,,,,,,,,,https://logo.clearbit.com/fjord1.no,,26.567165000000003,,,,,,
FKRAFT,Fjordkraft Holding,Utilities,81.8,81.5,81.8,458,,8555.15,0.0086,0.0161,0.07629999999999999,0.4682,0.8472,5147,Utilities,293.0,"Fjordkraft Holding ASA, together with its subsidiaries, engages in the purchase, sale, and portfolio management of electrical power to households, private and public companies, and municipalities in Norway. It operates through Consumer and Business segments. The Consumer segment sells electrical power and related services to private consumers. The Business segment sells electrical power and related services to business consumers. The company also provides mobile phone services to private customers. Fjordkraft Holding ASA was founded in 2001 and is headquartered in Bergen, Norway.",Bergen,47 23 00 61 00,Norway,[],http://www.fjordkraft.no,1.0,Folke Bernadottes Vei 38,Utilities—Regulated Electric,81.1,82.0,73.00365,0.03699137,0.5528,,82.5,,85177.0,,81.1,77.66765,3.0,82.0,,85177.0,,,,3.0,1587600000.0,0.1875,,,81.0,2.0,NOK,659437.0,,,,8555134976.0,,,238355.0,1.4531878,81.0,81.6,,0.0,659437.0,85.9,,,,42.1,81.3,False,0.037100002,0.0,82.5,OSL,FJORDKRAFT HLDG,Fjordkraft Holding ASA,Europe/Oslo,CEST,False,7200000.0,EQUITY,FKRAFT.OL,finmb_551325968,no_market,,1.355,,0.07124,13.449000000000002,0.7630434,,,,104586000.0,,,11.130999999999998,,,,1577750400.0,0.41085997,419416000.0,3.9819999999999998,,0.14325917,7.348846000000001,0.3204,1640908800.0,1585612800.0,,,85416677.0,7978970624.0,,,,,,0.366,,,,,,,,https://logo.clearbit.com/fjordkraft.no,,20.54244,,,,,,
FLNG,FLEX LNG,Energy,52.9,52.1,52.9,328,,2862.45,0.0302,0.0373,0.1401,-0.4067,-0.4923,HM08,Energy,8.0,"Flex LNG Ltd., through its subsidiaries, engages in the seaborne transportation of liquefied natural gas (LNG) worldwide. As of December 31, 2019, it owned and operated six LNG carriers. It also provides chartering and management services. Flex LNG Ltd. was founded in 2006 and is based in Hamilton, Bermuda.",Hamilton,441 295 6935,Bermuda,[],http://www.flexlng.com,1.0,Par-La-Ville Place,Oil & Gas Midstream,51.35,50.6,54.175506999999996,0.0038948394,1.8944,,53.6,,49683.0,,51.35,47.370884000000004,0.2,50.6,,49683.0,,,,1.87,1583798400.0,0.541164,,,50.6,2.0,NOK,88820.0,,,,2862450944.0,,,134321.0,20.590506,50.6,53.0,,219600.0,88820.0,108.2,377.85715,,,38.1,52.4,False,0.0364,100000.0,53.6,OSL,FLEX LNG LTD (BM),Flex LNG Ltd.,Europe/Oslo,CEST,False,7200000.0,EQUITY,FLNG.OL,finmb_36151890,no_market,,24.834,,0.039760000000000004,34.711,-0.5024704000000001,,0.14,,54110600.0,,,15.136,,,,1577750400.0,0.19859000000000002,5528000.0,0.10099999999999999,,0.14325917,3.4949790999999997,0.4586,1640908800.0,1585612800.0,,,28836612.0,3452400384.0,,1552262400.0,1:10,,,,,,,,,,,https://logo.clearbit.com/flexlng.com,4th Floor 14 Par-La-Ville Road,523.7624,441 295 3494,,,,,
FRO,Frontline,Energy,73.0,72.95,73.3,1360,,14431.54,0.0,0.0253,0.1128,-0.2515,0.2884,HM 08,Energy,157.0,"Frontline Ltd., a shipping company, engages in the seaborne transportation of crude oil and oil products worldwide. It owns and operates oil and product tankers. As of December 31, 2019, the company operated a fleet of 71 vessels. It is also involved in the charter, purchase, and sale of vessels. Frontline Ltd. is based in Hamilton, Bermuda.",Hamilton,441 295 6935,Bermuda,[],http://www.frontline.bm,1.0,Par-la-Ville Place,Oil & Gas Midstream,73.0,72.8,81.461235,0.016438358,0.3623,,74.2,,386354.0,,73.0,70.810295,1.2,72.8,,386354.0,,,,27.07,1591142400.0,0.257861,,,72.45,2.0,NOK,609644.0,,,,14281719808.0,,,1111190.0,12.636722,72.45,72.9,,173100.0,609644.0,123.0,169.76744,,,55.0,72.75,False,0.3739,75700.0,74.2,OSL,FRONTLINE LTD,Frontline Ltd.,Europe/Oslo,CEST,False,7200000.0,EQUITY,FRO.OL,finmb_144797851,no_market,,14.562999999999999,,0.23471999999999998,33.105,0.15840006,,0.43,,197692000.0,,,8.113999999999999,,,,1577750400.0,0.29650998,265272000.0,1.4240000000000002,,0.14325917,8.996796,0.50473,1640908800.0,1585612800.0,,,98284714.0,16458514432.0,,1454544000.0,1:5,,,3.13,,,,,,,,https://logo.clearbit.com/frontline.bm,14 Par-la-Ville Road PO Box HM 1593,51.264046,441 295 3494,,,,,
GIG,Gaming Innovation Group,Consumer discretionary,8.0,7.93,8.0,279,,714.31,0.0568,0.0959,0.4414,-0.0232,-0.3043,STJ 3148,Consumer Cyclical,594.0,"Gaming Innovation Group Inc., through its subsidiaries, provides and facilitates a platform for Internet gambling, gaming, and betting in Nordic countries, other European countries, and internationally. It operates in two segments, Business-to-Business (B2B) and Business-to-Consumer (B2C). The company offers profile management system with integrated KYC tools to verify end users, which comprises of payment gateway, gaming tools, and regulatory adaption engine, as well as bonus, affiliate, and content management systems. It also designs, hosts, and distributes in-house-developed and third-party games, such as casino; and offers sportsbook solutions that helps the customers to offer betting experience to their end users. In addition, it provides iGaming end user leads for casino and sportsbook customers using the techniques and technology in social media, adwords, permission marketing, and display advertising; and digital agency, which comprises of ad-tech, publishing, and paid media channels. Additionally, it offers front end development, compliance standards, payments, and product management services. Further, the company offers B2C casino, sports betting, and poker services through its own brands, such as Guts.com, Betspin.com, Rizk.com, SuperLenny.com, Kaboo.com, Thrills.com, and Highroller.com. The company was founded in 2012 and is headquartered in St Julians, Malta.",St Julians,356 2711 0277,Malta,[],http://www.gig.com,1.0,@GiG Beach,Gambling,7.57,8.13,5.273868599999999,,0.0,,8.24,,356306.0,,7.57,6.092353,,8.13,,356306.0,,,,,,0.8860459999999999,,,7.89,2.0,NOK,647094.0,,,,720044800.0,,,261450.0,,7.89,8.0,,86600.0,647094.0,12.2,80.0,,,2.05,7.99,False,,1568100.0,8.24,OSL,GAMING INNOVATION,Gaming Innovation Group Inc.,Europe/Oslo,CEST,False,7200000.0,EQUITY,GIG.OL,finmb_285246636,no_market,,,,-1.50549,,-0.36842108,,0.1,,90005600.0,,,1.355,,,,1577750400.0,0.13146,,-0.08,,0.14325917,5.904058999999999,0.53973,1640908800.0,1585612800.0,,,37909470.0,681342592.0,,1545177600.0,1:10,,,,,,,,,,,https://logo.clearbit.com/gig.com,Golden Mile Business Centre Triq Id-Dragunara,,,,,,,
RISH,GC Rieber Shipping,Industrials,5.65,5.5,5.8,6,,486.09,-0.08869999999999999,-0.08130000000000001,-0.096,-0.311,-0.3722,5058,Industrials,32.0,"GC Rieber Shipping ASA engages in the design, development, construction, and maritime operation of specialized vessels within the offshore/shipping business in Norway, Great Britain, Africa, and the Netherlands. It operates through Subsea and Ice/Support segments. The Subsea segment owns and operates subsea vessels that are primarily used for construction, inspection, maintenance, and repair of subsea installations. The Ice/Support segment owns and operates a vessel within ice/support that provides services for scientific expeditions and logistics operations, as well as for the oil and gas sector. The company operates 11 vessels and has direct and indirect ownership of 23 advanced special purpose vessels. It also provides marine ship management and project development services. The company was founded in 1879 and is headquartered in Bergen, Norway. GC Rieber Shipping ASA is a subsidiary of GC Rieber AS.",Bergen,47 55 60 68 00,Norway,[],http://www.gcrieber-shipping.com,1.0,Solheimsgaten 15,Marine Shipping,6.2,6.2,6.6626277,0.08064517,0.0,,6.2,,818.0,,6.2,6.0985293,0.5,6.2,,818.0,,,,,1428624000.0,0.9465110000000001,,,5.65,2.0,NOK,625.0,,,,486085344.0,,,6421.0,2.4089272,5.65,5.65,,110000.0,625.0,11.5,,,,4.5,5.75,False,,100000.0,6.2,OSL,GC RIEBER SHIPPING,GC Rieber Shipping ASA,Europe/Oslo,CEST,False,7200000.0,EQUITY,RISH.OL,finmb_884214,no_market,,8.127,,-0.90569,20.215999999999998,-0.27058828,,,,86032800.0,,,20.62,,,,1577750400.0,0.018969999999999997,-182755008.0,-2.124,,0.14325917,0.2740058,0.92489,1640908800.0,1585612800.0,,,8121469.0,1639836544.0,,1176422400.0,10:1,,,,,,,,,,,https://logo.clearbit.com/gcrieber-shipping.com,,,,,,,,
GENT-ME,Gentian Diagnostics,Health care,63.0,60.0,62.5,24,,970.37,0.0244,0.0244,0.1776,0.0096,0.255,1596,Healthcare,46.0,"Gentian Diagnostics AS researches, develops, and produces biochemical reagents for use in medical diagnostics and research in Europe, Asia, the United States. It offers in-vitro diagnostic (IVD) and molecular diagnostic tests for medical laboratories and universities. The company's products include Plasma Calprotectin, a particle enhanced turbidimetric immunoassay (PETIA) for quantitative analysis of total calprotectin in plasma; and Cystatin C, a PETIA for use on a range of clinical chemistry analyzers. . It also offers Canine CRP, an IVD test for the quantitative determination of Canine CRP in dog serum plasma; PreTect HPV-Proofer, an assay for the qualitative detection of the presence of human papillomavirus; and PreTect SEE, a control test for NILM cytology. The company was founded in 2001 and is headquartered in Moss, Norway.",Moss,47 99 33 99 05,Norway,[],http://www.gentian.com,1.0,Bjornasveien 5,Diagnostics & Research,61.5,61.5,52.00365,,0.0,,63.5,,2612.0,,61.5,56.45588299999999,,61.5,,2612.0,,,,,,0.682941,,,61.5,2.0,NOK,5971.0,,,,970370112.0,,,7715.0,15.537854999999999,61.5,62.5,,,5971.0,66.8,,,,38.0,60.5,False,,,63.5,OSL,GENTIAN DIAGNOSTIC,Gentian Diagnostics AS,Europe/Oslo,CEST,False,7200000.0,EQUITY,GENT-ME.OL,finmb_413765020,no_market,,12.648,,-0.61030996,-31.549,0.23000002,,,,15402700.0,,,13.222000000000001,,,,1577750400.0,0.26521999999999996,-38115000.0,-2.477,,0.14325917,4.764786,0.48766997,1640908800.0,1585612800.0,,,6773345.0,789903168.0,,,,,,,,,,,,,,https://logo.clearbit.com/gentian.com,,,,,,,,
GJF,Gjensidige Forsikring,Financials,188.8,188.6,188.8,1554,,94397.88,-0.0021,-0.0084,0.0362,0.024700000000000003,0.0929,0191,Financial Services,3620.0,"Gjensidige Forsikring ASA operates as a general insurance company in Norway, Denmark, Sweden, Lithuania, Latvia, and Estonia. The company operates through six segments: General Insurance Private, General Insurance Commercial, General Insurance Denmark, General Insurance Sweden, General Insurance Baltics, and Pension. It offers various insurance products, including motor vehicles, property, leisure boats, and accident and health insurance products, as well as insurance products in the areas of liability, commercial, municipality, and agriculture, coastal and marine/transport, and defined contribution scheme; travel; and life and pet insurance products. The company also provides pension and savings products comprising occupational pensions, private pension savings, spouse/cohabitant pension, child's pension, and individual disability pensions. It distributes its products through its distribution network, as well as through agents, partnerships, brokers, telephone, digital solutions, and sales offices to private and commercial customers. The company is headquartered in Oslo, Norway. Gjensidige Forsikring ASA is a subsidiary of Gjensidigestiftelsen.",Oslo,47 91 50 31 00,Norway,[],http://www.gjensidige.no,1.0,Schweigaardsgate 21,Insurance—Diversified,189.2,189.3,184.9989,0.03752643,0.0,,190.5,,290397.0,,189.2,184.52353,7.1,189.3,,290397.0,,,,,1585267200.0,0.42674399999999996,,,188.1,2.0,NOK,277911.0,,,,94400004096.0,,,532719.0,3.4226587,188.1,188.6,,118100.0,277911.0,208.8,19.831932000000002,,,145.25,188.4,False,,96300.0,190.5,OSL,GJENSIDIGE FORSIKR,Gjensidige Forsikring ASA,Europe/Oslo,CEST,False,7200000.0,EQUITY,GJF.OL,finmb_4497069,no_market,,1.9140000000000001,,0.14282999999999998,10.042,0.108204484,,9.52,,500000000.0,,,56.1,,,,1577750400.0,0.30024,3939399936.0,7.877999999999999,,0.14325917,3.3654191,0.6395,1640908800.0,1593475200.0,,,497370053.0,52800077824.0,,,,,,0.455,,,,,,,,https://logo.clearbit.com/gjensidige.no,,23.965475,,,,,,
GEOS-ME,Golden Energy Offshore Services,Energy,1.03,0.97,,0,,47.04,,,,,,6002,Industrials,,"Golden Energy Offshore Services AS engages in the shipping business in Europe and Africa. The company owns 4 offshore service vessels. Golden Energy Offshore Services AS was incorporated in 2013 and is headquartered in Aalesund, Norway.",Alesund,47 70 10 26 60,Norway,[],http://www.geoff.no,1.0,St Olavs Plass 1,Marine Shipping,1.03,1.03,1.8271533,,0.0,,1.03,,0.0,,1.03,1.2105882,,1.03,,0.0,,,,,,0.409149,,,1.03,4.0,NOK,0.0,,,,47044012.0,,,1003.0,0.42625448,1.03,0.0,,,0.0,5.9,,,,1.0,0.95,False,,,1.03,OSL,GOLDEN ENGY OFFSHO,Golden Energy Offshore Services AS,Europe/Oslo,CEST,False,7200000.0,EQUITY,GEOS-ME.OL,finmb_382050544,no_market,,2.633,,-0.15581,17.076,-0.81929827,,,,45673800.0,,,8.079,,,,1577750400.0,0.4456,-17196492.0,-0.541,,0.14325917,0.12749101,0.0,1640908800.0,1577750400.0,,,19335649.0,290545120.0,,,,,,,,,,,,,,https://logo.clearbit.com/geoff.no,,,47 70 10 26 61,,,,,
GOGL,Golden Ocean Group,Industrials,36.5,36.5,36.6,1525,,5229.64,0.022400000000000003,0.1034,-0.0435,-0.2747,-0.2474,HM 08,Industrials,37.0,"Golden Ocean Group Limited, a shipping company, owns and operates a fleet of dry bulk vessels comprising of Newcastlemax, Capesize, Panamax, and Ultramax vessels worldwide. It owns and operates dry bulk vessels in the spot and time charter markets. The company transports bulk commodities, such as ores, coal, grains, and fertilizers. As of March 12, 2020, it owned a fleet of 67 vessels. Golden Ocean Group Limited is based in Hamilton, Bermuda.",Hamilton,441 295 6935,Bermuda,[],http://www.goldenocean.bm,1.0,Par-la-Ville Place,Marine Shipping,35.7,36.0,36.35066,0.008403362,,,37.26,,856340.0,,35.7,36.712353,0.3,36.0,,856340.0,,,,2.24,1583366400.0,1.754061,,,35.8,2.0,NOK,1031318.0,,,,5229646848.0,,,1107127.0,7.272823,35.8,36.48,,470900.0,1031318.0,59.6,,,,26.5,36.44,False,0.0641,400000.0,37.26,OSL,GOLDEN OCEAN GROUP,Golden Ocean Group Limited,Europe/Oslo,CEST,False,7200000.0,EQUITY,GOGL.OL,finmb_262789605,no_market,,8.922,,-0.16155,34.36,-0.2750311,,,,143278000.0,,,9.389,,,,1577750400.0,0.2715,-116166000.0,-0.818,,0.14325917,3.887528,0.36176997,1640908800.0,1585612800.0,,,91444125.0,6415481856.0,,1470009600.0,1:5,,,,,,,,,,,https://logo.clearbit.com/goldenocean.bm,14 Par-la-Ville Road PO Box HM 1593,,441 295 3494,,,,,
GOD,Goodtech,Industrials,6.8,6.7,6.95,9,LP,153.78,-0.0073,-0.0073,0.0303,-0.0073,0.0074,0663,Industrials,,"Goodtech ASA operates as an automation, power, and industrial engineering company in Norway, Sweden, Finland, Europe, and internationally. It designs and supplies turnkey systems to convert and modernize existing systems, such as operator, process safety, industrial IT, and control systems; and provides service and support in electrical, mechanical, automation, and industrial IT sectors. The company also delivers proprietary technologies and customized solutions, including packaging machines, bulk handling systems, and logistic and machining solutions, as well as provides engineering and aftermarket services. In addition, it supplies power systems for power, oil and gas, and renewable energy industries; and constructs and operates electrical systems. Further, the company provides products and solutions, such as water purification, waste water treatment, industrial water, energy recovery technology, and biogas systems. It serves a range of customers within process and manufacturing, aquaculture, oil and gas, power, and water treatment industries. Goodtech ASA was founded in 1913 and is headquartered in Oslo, Norway.",Oslo,47 81 56 86 00,Norway,[],http://www.goodtech.no,1.0,Innspurten 15,Engineering & Construction,6.85,6.9,6.5198540000000005,0.21897809999999998,0.0,,6.9,,1301.0,,6.85,6.763235000000001,1.5,6.9,,1301.0,,,,,1398643200.0,1.169186,,,6.75,2.0,NOK,21539.0,,,,153779280.0,,,19920.0,0.34116086,6.75,6.85,,27800.0,21539.0,9.0,,,,4.72,6.7,False,,66200.0,6.9,OSL,GOODTECH ASA,Goodtech ASA,Europe/Oslo,CEST,False,7200000.0,EQUITY,GOD.OL,finmb_7668624,no_market,,0.41100000000000003,,0.00045000002,-43.674,0.030075192,,,,22614600.0,,,10.152000000000001,,,,1577750400.0,0.029460002000000002,-8442000.0,0.009000000000000001,,,0.66981876,0.59415,1640908800.0,1585612800.0,,,12468544.0,185394816.0,,1336348800.0,1:10,,,-0.8390000000000001,,,,,,,,https://logo.clearbit.com/goodtech.no,Etterstad PO Box 6578,755.5556,,,,,29ef84a6-23af-3318-aff7-9e049cd7307d,
GSF,Grieg Seafood,Consumer staples,95.5,95.5,95.55,1059,,10546.41,0.0143,0.032400000000000005,-0.0175,-0.3193,-0.2289,,,,,,,,,,,,,,,,,,,,,,,,,,,,,,,,,,,,,,,,,,,,,,,,,,,,,,,,,,,,,,,,,,,,,,,,,,,,,,,,,,,,,,,,,,,,,,,,,,,,,,,,,,,,,,,,,,,,,,,,,,,,,,
GRONG-ME,Grong Sparebank,Equity certificates,113.0,110.0,112.0,5,LP,335.89,,,0.0,0.1147,0.1466,7870,Financial Services,,"Grong Sparebank, an independent savings bank, provides a range of banking products and services in Norway. It offers bank savings accounts; fund savings; retirement savings; and car loans, mortgage loans, loans to other vehicles, and other loans and refinancing services. The company also provides various type of insurance, such as home and leisure, car and other vehicle, animal, building, mortgage, employee, and business insurance; bank guarantees, construction loans, overdrafts, leasing facilities, and corporate loans; credit facilities; payment and bank cards, and Internet and mobile banking services; and real estate agency services. It has branches in SnÃ¥sa, Lierne, MosjÃ¸en, Namsos, Steinkjer, and RÃ¸rvik. Grong Sparebank was founded in 1862 and is based in Grong, Norway.",Grong,47 74 31 28 60,Norway,[],http://www.grong-sparebank.no,1.0,Sundspetvegen 2,Banks—Regional,110.0,110.0,107.95621000000001,0.06363636,0.9235,,113.0,,423.0,,110.0,111.52941000000001,7.0,110.0,,423.0,,,,7.0,1584057600.0,0.064499,,,110.0,2.0,NOK,1676.0,,,,335890240.0,,,925.0,1.9193727999999999,110.0,112.0,,,1676.0,118.0,,,,96.0,110.0,False,0.0636,,113.0,OSL,GRONG SPAREBANK,Grong Sparebank,Europe/Oslo,CEST,False,7200000.0,EQUITY,GRONG-ME.OL,finmb_42115965,no_market,,8.87,,0.28221,,0.047619104,,,,2972480.0,,,256.785,,,,1577750400.0,0.03611,24044000.0,7.622999999999999,,,0.44005686,0.0,1640908800.0,1585612800.0,,,1992599.0,1552186240.0,,,,,,-0.37,,,,,,,,https://logo.clearbit.com/grong-sparebank.no,,14.82356,47 74 31 28 61,,,,e1a9280d-7287-3862-aa78-b95ec7bce240,
GYL,Gyldendal,Consumer discretionary,525.0,482.0,525.0,6,,1211.24,0.0096,,0.15130000000000002,0.1846,0.3394,0164,Communication Services,,"Gyldendal ASA, through its subsidiaries publishes and sells books in Norway. It also operates 142 bookstores; and ark.no, an online bookstore. In addition, it publishes dictionaries, and encyclopedias and other reference books in book and digital forms. The company was founded in 1925 and is based in Oslo, Norway.",Oslo,47 22 03 41 00,Norway,[],http://www.gyldendalasa.no,1.0,Sehestedsgate 4,Publishing,520.0,496.0,491.54745,0.01923077,0.4337,,525.0,,59.0,,520.0,494.58822999999995,10.0,496.0,,59.0,,,,7.0,1593129600.0,0.16453399999999999,,,490.0,2.0,NOK,88.0,,,,1211243264.0,,,40.0,0.5981747,490.0,510.0,,7100.0,88.0,600.0,,,2.01,326.0,490.0,False,0.0135,1300.0,525.0,OSL,GYLDENDAL ASA,Gyldendal ASA,Europe/Oslo,CEST,False,7200000.0,EQUITY,GYL.OL,finmb_9237616,no_market,,0.621,,0.01839,11.088,0.30653262,,,,2307130.0,,,356.81199999999995,,,,1577750400.0,0.0,37232000.0,16.137999999999998,,,1.4713631,0.9565799999999999,1640908800.0,1577750400.0,,,,1257702144.0,,,,,,-0.10300000000000001,,,,,,,,https://logo.clearbit.com/gyldendalasa.no,,32.531909999999996,,,,,416c704a-5f3e-33e9-8594-1e79dea9083e,
