MEDI,Medistim,Health care,230.0,230.0,232.0,131,,4186.19,-0.0295,0.036000000000000004,0.0599,0.1979,0.7829,0579,Healthcare,112.0,"Medistim ASA develops, produces, services, leases, and distributes medical devices for cardio-vascular surgery in the United States, Europe, Asia, and internationally. It offers MiraQ Cardiac, a system that combines ultrasound imaging and transit time flow measurement (TTFM) in a single system for cardiac surgery; MiraQ Vascular, a system that combines ultrasound imaging and transit TTFM in a single system for vascular surgery; and imaging probes for intraoperative use. The company also provides various flow probes, such as QuickFit TTFM probes to accurately measure blood volume flow intraoperatively in various range of surgical applications; Vascular TTFM probes for enhancing surgical outcomes; and doppler probes that are used on the surface of the heart/vessel to search for intramural coronary arteries or to locate the position and quantify the degree of a stenosis. In addition, it distributes and sells third party medical equipment. The company was founded in 1984 and is headquartered in Oslo, Norway.",Oslo,47 23 05 96 60,Norway,[],http://www.medistim.com,1.0,Okernveien 94,Medical Devices,237.0,237.0,191.31387,0.011603376,0.5435,,237.0,,4663.0,,237.0,218.55882000000003,2.75,237.0,,4663.0,,,,,1556150400.0,0.134883,,,225.0,2.0,NOK,3249.0,,,,4183424000.0,,,13945.0,11.26745,225.0,230.0,,34000.0,3249.0,240.0,87.12120999999999,,,124.0,228.0,False,,3000.0,237.0,OSL,MEDISTIM ASA,Medistim ASA,Europe/Oslo,CEST,False,7200000.0,EQUITY,MEDI.OL,finmb_7885356,no_market,,11.455,,0.20319,39.37,0.83720934,,2.64,,18188800.0,,,14.897,,,,1577750400.0,0.58257,75442000.0,4.14,,,15.43935,0.2159,1640908800.0,1585612800.0,,,12646305.0,4253108224.0,,,,,,0.322,,,,,,,,https://logo.clearbit.com/medistim.com,,55.55555699999999,,,,,8430cf52-3196-391c-9a0a-0357ebb01f61,
MELG,Melhus Sparebank,Equity certificates,139.0,137.0,139.0,3,LP,385.78,0.0146,0.0146,0.053,0.0588,0.1944,7224,Financial Services,,"Melhus Sparebank, a savings bank, provides various banking products and services to companies, agriculture customers, and private individuals in Norway. The company offers savings accounts; car loans, mortgages, and payment services; loans for other vehicles; and banking and bank cards. It also provides various insurance products, including auto, health, buildings, property, UNG, and income insurance; savings and pension products; payment services; and online and mobile banking services. The company operates through branch offices in central Trondheim, Heimdal, Ler, and Korsvegen. Melhus Sparebank was founded in 1840 and is headquartered in Melhus, Norway.",Melhus,,Norway,[],http://www.melhusbanken.no,1.0,Melhusvegen 439,Banks—Regional,137.0,139.0,132.0,0.07299270000000001,0.77760005,,139.0,,166.0,,137.0,133.11765,10.0,139.0,,166.0,,,,10.0,1583452800.0,0.143023,,,139.0,2.0,NOK,120.0,,,,385894592.0,,,659.0,1.7743179,139.0,139.0,,,120.0,150.0,,,7.18,120.0,137.0,False,0.073,,139.0,OSL,MELHUS SPAREBANK,Melhus Sparebank,Europe/Oslo,CEST,False,7200000.0,EQUITY,MELG.OL,finmb_8952942,no_market,,8.454,,0.42876998,,0.10483873,,11.7,,2776220.0,,,373.44800000000004,,,,1577750400.0,0.05159,37995000.0,12.767000000000001,,,0.3722071,0.40271,1640908800.0,1585612800.0,,,1704519.0,1838738816.0,,,,,,-0.24600000000000002,,,,,,,,https://logo.clearbit.com/melhusbanken.no,,10.8874445,,,,,48b41af4-8c0c-3734-ac3b-e365976127fe,
MRCEL-ME,Mercell Holding,Information technology,7.65,7.66,7.7,100,,2216.91,-0.013,-0.0192,,,,0663,Technology,187.0,"Mercell Holding AS provides software platform for public e-tendering and procurement in the Nordic region. The company's software enables easy compliance with EU regulations for public buyers that are required by law to publish tenders through an e-tendering platform. Its two-sided SaaS marketplace platform also caters to the needs of the supply side and facilitates interaction between buyers and suppliers. The company also offers tender consulting services. Mercell Holding AS was founded in 1999 and is headquartered in Oslo, Norway.",Oslo,47 21 01 88 00,Norway,[],http://www.mercell.com,1.0,Grensesvingen 6,Software—Application,7.751,7.8,,,0.0,,7.8,,,,7.751,,,7.8,,,,,,,,,,,7.521,2.0,NOK,990954.0,,,,2216067328.0,,,,13.361215,7.521,7.7,,,990954.0,7.8,,,,7.521,7.66,False,,,7.8,OSL,MERCELL HOLDING AS,Mercell Holding AS,Europe/Oslo,CEST,False,7200000.0,EQUITY,MRCEL-ME.OL,finmb_254089355,no_market,,10.421,,-0.3549,253.479,,,,,289681984.0,,,0.466,,,,1577750400.0,,-58862548.0,-0.264,,,16.41631,,1640908800.0,,,,93737027.0,1728330752.0,,,,,,,,,,,,,,https://logo.clearbit.com/mercell.com,,,,,,,345d8233-c554-328e-9966-89a297fb5c37,
MOWI,Mowi,Consumer staples,171.6,171.4,171.6,3544,,88736.26,0.0076,0.0151,-0.0278,-0.2393,-0.1913,,,,,,,,,,,,,,,,,,,,,,,,,,,,,,,,,,,,,,,,,,,,,,,,,,,,,,,,,,,,,,,,,,,,,,,,,,,,,,,,,,,,,,,,,,,,,,,,,,,,,,,,,,,,,,,,,,,,,,,,,,,,,,
MPCC,MPC Container Ships,Industrials,2.83,2.8,2.83,54,LP,1011.74,0.0035,0.0107,-0.4227,-0.828,-0.8581,0250,Industrials,20.0,"MPC Container Ships ASA owns and operates a portfolio of container ships. It focuses on the feeder vessels between 1,000 and 3,000 TEU. The company was incorporated in 2017 and is based in Oslo, Norway.",Oslo,,Norway,[],http://www.mpc-container.com,1.0,Munkedamsveien 45,Marine Shipping,2.82,2.85,10.512919,,0.0,,2.85,,505397.0,,2.82,4.752059,,2.85,,505397.0,,,,,,0.972707,,,2.76,4.0,NOK,180759.0,,,,1011739072.0,,,434645.0,5.4949384000000006,2.76,2.8,,0.0,180759.0,24.5,8.323528999999999,,,1.765,2.8,False,,0.0,2.85,OSL,MPC CONTAIN SHIPS,MPC Container Ships ASA,Europe/Oslo,CEST,False,7200000.0,EQUITY,MPCC.OL,finmb_427614703,no_market,,2.7689999999999997,,-0.23218000000000003,20.462,-0.87792206,,0.34,,357504992.0,,,4.427,,,,1577750400.0,0.54237,-42749000.0,-0.503,,,0.63925904,0.20035999999999998,1640908800.0,1585612800.0,,,87504914.0,509841376.0,,,,,,,,,,,,,,https://logo.clearbit.com/mpc-container.com,,,,,,,539e7654-6def-3085-b2ea-284d32d0bb7b,
MULTI,Multiconsult,Industrials,68.0,67.5,68.0,2,,1827.19,0.0,0.0,0.0462,-0.0556,0.1184,,,,,,,,,,,,,,,,,,,,,,,,,,,,,,,,,,,,,,,,,,,,,,,,,,,,,,,,,,,,,,,,,,,,,,,,,,,,,,,,,,,,,,,,,,,,,,,,,,,,,,,,,,,,,,,,,,,,,,,,,,,,,,
NAPA,Napatech,Information technology,7.69,7.68,7.69,82,,638.71,-0.0077,0.1342,0.6396999999999999,0.6467,4.4929000000000014,2860,Technology,81.0,"Napatech A/S provides reconfigurable computing solutions for network performance and cybersecurity applications worldwide. It provides Link Capture Software that enables packet capture with nanosecond timestamping and replay with precise inter-frame gap control; Link Virtualization Software that offloads and accelerates the Open vSwitch (OVS) dataplane to enhance CPU efficiency, scalability and network performance; and Link Programmable, which enables end users and OEMs to deploy FPGA IP on SmartNIC platform. The company also offers FPGA SmartNICs that captures data from networks enabling real-time insight into network traffic; and FPGA Cloud Crypto, a cryptography engine that provides technology demonstration and playground for users to learn, experiment, and adapt use cases for FPGA-based crypto offload. It also provides solutions for telecom operators, cloud and data center service providers, and infrastructure and defense, as well as cyber security, financial services, and network management industries. The company was founded in 2003 and is headquartered in Copenhagen, Denmark.",Copenhagen,45 45 96 15 00,Denmark,[],http://www.napatech.com,1.0,Tobaksvejen 23 A,Communication Equipment,7.75,7.75,4.3840513,,0.0,,7.99,,301370.0,,7.75,5.6539707,,7.75,,301370.0,,,,,,0.27965100000000004,,,7.51,2.0,NOK,337072.0,,,,638711424.0,,,172071.0,,7.51,7.73,,99400.0,337072.0,8.1,,,,1.1,7.68,False,,30200.0,7.99,OSL,NAPATECH A/S,Napatech A/S,Europe/Oslo,CEST,False,7200000.0,EQUITY,NAPA.OL,finmb_8539253,no_market,,,,-0.03329,,4.595668,,,,83057400.0,,,0.397,,,,1577750400.0,0.50098,,-0.862,,,19.370276999999998,0.27607,1640908800.0,1585612800.0,,,39394965.0,643694976.0,,1461542400.0,4:1,,,,,,,,,,,https://logo.clearbit.com/napatech.com,Soeborg,,,,,,77ae3d22-1352-3a37-bd31-8bfb96439299,
NATTO,NattoPharma,Consumer staples,17.8,17.5,17.8,30,LP,347.68,-0.005600000000000001,0.0289,-0.0111,1.3733000000000002,0.7282,0283,Healthcare,18.0,"NattoPharma ASA engages in the research and development of vitamin K2 for applications in the marketplace for nutritional supplements and enriched foods. The company's flagship brand is MenaQ7, a vitamin K2 for bone and cardiovascular health. It also provides marketing and sales support services. The company has a partnership agreement with KD Nutra to create a cardiovascular-support ingredient that combines KD Nutra's KD-PÃ¼R high concentrate omega-3s with the company's MenaQ7 PharmaPure MK-7. NattoPharma ASA was founded in 2004 and is headquartered in Oslo, Norway.",Oslo,47 40 00 90 08,Norway,[],http://www.nattopharma.com,1.0,Lilleakerveien 2B,Drug Manufacturers—Specialty & Generic,17.9,18.0,11.465328,,0.0,,18.0,,43177.0,,17.9,17.332354000000002,,18.0,,43177.0,,,,,,0.954651,,,17.3,2.0,NOK,11970.0,,,,347683840.0,,,107666.0,1.9981830000000003,17.3,17.7,,180100.0,11970.0,22.0,-254.2857,,,5.35,17.5,False,,39300.0,18.0,OSL,NATTOPHARMA ASA,NattoPharma ASA,Europe/Oslo,CEST,False,7200000.0,EQUITY,NATTO.OL,finmb_35560724,no_market,,2.043,,0.11957999999999999,18.561,,,-0.07,,19532800.0,,,6.652,,,,1577750400.0,0.00302,20807000.0,1.092,,,2.6758869,0.64835,1640908800.0,1593475200.0,,,5897926.0,355495936.0,,1320278400.0,1:100,,,,,,,,,,,https://logo.clearbit.com/nattopharma.com,,16.300365,,,,,0a7a07b6-bc2e-34cc-b55a-ceca2e87b275,
NAVA,Navamedic,Health care,19.3,19.2,19.3,8,,292.72,0.0,-0.035,-0.0446,0.0444,-0.018500000000000003,0255,Healthcare,24.0,"Navamedic ASA, a pharmaceutical company, markets and sells pharmaceuticals and other health care products in Northern European region. The company's product portfolio includes generic, branded, and patented pharmaceuticals, as well as medical devices, food supplements, cosmetics, and other health care products. It also distributes medical nutrition products for various metabolic disorders, including phenylketonuria, homocystinuria, maple syrup urine disease, tyrosinemia type 1, MMA/PA, IVA, renal, MCT, low protein, single dose amino acids, glycogen storage disease, and ketogenic diet, as well as other products. In addition, the company sells consumer care products consisting of non-prescription drugs and health care products primarily through pharmacies and drugstores. It sells, markets, and distributes its products to hospitals, patients, and pharmacies. The company was formerly known as Glucomed AS and changed its name to Navamedic ASA in 2004. Navamedic ASA was founded in 2002 and is headquartered in Oslo, Norway.",Oslo,47 67 11 25 40,Norway,[],http://www.navamedic.com,1.0,Henrik Ibsens gate 90,Drug Manufacturers—General,19.3,19.0,19.285145,,0.0,,19.8,,10967.0,,19.3,20.044117,,19.0,,10967.0,,,,,1271116800.0,0.379651,,,19.0,2.0,NOK,2828.0,,,,292721152.0,,,17176.0,1.4712199,19.0,19.25,,491200.0,2828.0,25.5,,,,12.3415,19.2,False,,96200.0,19.8,OSL,NAVAMEDIC ASA,Navamedic ASA,Europe/Oslo,CEST,False,7200000.0,EQUITY,NAVA.OL,finmb_26201104,no_market,,1.042,,0.109,-33.013000000000005,0.008011818,,,,15166900.0,,,6.676,,,,1577750400.0,0.13567,-26384224.0,2.386,,,2.8909526000000003,0.6138399999999999,1640908800.0,1585612800.0,,,3819255.0,207346096.0,,,,,,,,,,,,,,https://logo.clearbit.com/navamedic.com,,8.088852000000001,,,,,1874534f-9016-3c5f-9005-de69a6ce30f9,
NKR,Nekkar,Industrials,3.75,3.59,3.75,24,,396.05,0.0027,0.0417,-0.053,0.8293,0.298,5058,Industrials,50.0,"Nekkar ASA operates in shipyard, drilling, and aqua cultural industries. The company offers shipyard solutions, including Syncrolift ship lifting systems used for the retrieval and launching of ships, as well as for launching concrete caissons, offshore structures, and wind farm equipment; and FastDocking products for the docking, launching, and repair operations of ships. It also offers equipment and upgrades, operator training, and spare parts; Intellilift for the offshore energy and other industries. The company was formerly known as TTS Group ASA and changed its name to Nekkar ASA in July 2019. Nekkar ASA founded in 1966 and is headquartered in Bergen, Norway.",Bergen,,Norway,[],http://www.nekkar.com,1.0,Solheimsgaten 16,Specialty Industrial Machinery,3.74,3.8,2.7580292,1.0695187,8.6957,,3.8,,148433.0,,3.74,3.7205882000000003,4.0,3.8,,148433.0,,,,4.0,1568937600.0,0.473837,,,3.58,4.0,NOK,28169.0,,,,396048736.0,,,277899.0,1.4854761,3.58,3.75,,,28169.0,7.0,,,,1.505,3.59,False,1.0989,,3.8,OSL,NEKKAR ASA,Nekkar ASA,Europe/Oslo,CEST,False,7200000.0,EQUITY,NKR.OL,finmb_884363,no_market,,0.563,,0.73452,4.258,-0.44011974,,,,105613000.0,,,2.059,,,,1577750400.0,0.13253,47717000.0,2.072,,,1.8212724999999998,0.62224,1640908800.0,1577750400.0,,,42370002.0,150096288.0,,,,,,,,,,,,,,https://logo.clearbit.com/nekkar.com,entrance B,1.8098456000000003,,,,,185b0aea-df47-3f88-9093-af548aa196ba,
NEL,NEL,Industrials,18.75,18.75,18.76,7301,,26276.07,-0.0064,0.0062,-0.0526,1.1705,1.6821000000000002,,,,,,,,,,,,,,,,,,,,,,,,,,,,,,,,,,,,,,,,,,,,,,,,,,,,,,,,,,,,,,,,,,,,,,,,,,,,,,,,,,,,,,,,,,,,,,,,,,,,,,,,,,,,,,,,,,,,,,,,,,,,,,
NEXT,NEXT Biometrics Group,Information technology,2.34,2.29,2.34,81,,177.33,0.0043,-0.0311,0.1502,-0.3144,-0.446,0164,Technology,65.0,"NEXT Biometrics Group ASA, through its subsidiaries, engages in the research, development, manufacture, and commercialization of fingerprint technology and products in Asia. The company offers fingerprint sensor modules and readers, and flexible biometric subassemblies, as well as software and hardware development kits for USB and SPI modules. Its products are used in smart card, government ID, access control, and notebook applications. The company sells its sensors to distributors of electronic components. NEXT Biometrics Group ASA is headquartered in Oslo, Norway.",Oslo,47 22 70 00 95,Norway,[],http://www.nextbiometrics.com,1.0,Universitetsgata 10,Scientific & Technical Instruments,2.325,2.375,2.6106896,,0.0,,2.375,,546651.0,,2.325,2.2074118,,2.375,,546651.0,,,,,,2.934302,,,2.255,4.0,NOK,227791.0,,,,177330400.0,,,792223.0,2.2904394,2.255,2.31,,110000.0,227791.0,6.35,-0.38278690000000004,,,1.07,2.295,False,,12400.0,2.375,OSL,NEXT BIOMETRICS GR,NEXT Biometrics Group ASA,Europe/Oslo,CEST,False,7200000.0,EQUITY,NEXT.OL,finmb_61572672,no_market,,0.629,,-2.0371099999999998,-0.33,-0.45740956,,-6.1,,75944496.0,,,2.4019999999999997,,,,1577750400.0,0.03532,-157716992.0,-3.529,,,0.97210664,0.38145,1640908800.0,1585612800.0,,,32628954.0,48717588.0,,,,,,,,,,,,,,https://logo.clearbit.com/nextbiometrics.com,,,,,,,1140d622-f964-3ad8-bc48-278a028581e8,
NISB-ME,Nidaros Sparebank,Equity certificates,110.0,106.0,112.0,0,LP,123.1,,,-0.0179,0.0267,0.0953,7540,Financial Services,,"Nidaros Sparebank, a savings bank, provides loans, savings, insurance, pension products, and payment services for private and corporate customers in Norway. The company offers payment and card services, and mobile and online banking services; and car loans, mortgages, and loans to other vehicles; and savings and pensions, as well as investor services. It also provides bank guarantees, construction loans, overdrafts, leasing, and corporate loans; and children, auto, death fall, health, building, home, property, income, critical illness, disability, UNG, liability, agriculture, commercial vehicle, craft, lice, breeding and crew, staff, travel, and injuries insurance. The company was founded in 1858 and is based in KlÃ¦bu, Norway.",Klabu,47 72 83 00 00,Norway,[],http://nidaros-sparebank.no,1.0,Nordalsvegen 2,Banks—Regional,110.0,110.0,118.63503999999999,0.050090913,0.2824,,110.0,,21.0,,110.0,110.97058999999999,5.51,110.0,,21.0,,,,5.51,1583452800.0,,,,110.0,2.0,NOK,50.0,,,,124055800.0,,,111.0,1.4649088,110.0,112.0,,,50.0,130.0,,,,103.0,106.0,False,0.050100002000000005,,110.0,OSL,NIDAROS SPAREBANK,Nidaros Sparebank,Europe/Oslo,CEST,False,7200000.0,EQUITY,NISB-ME.OL,finmb_213538882,no_market,,11.023,,0.25988,,,,,,1127780.0,,,421.29,,,,1577750400.0,,22008000.0,19.500999999999998,,,0.26110279999999997,,1640908800.0,1585612800.0,,,,933468800.0,,,,,,,,,,,,,,https://logo.clearbit.com/nidaros-sparebank.no,,5.640736599999999,,,,,8380deb5-13e1-3a0f-8f92-109b5d0c617c,
NORBIT,NORBIT,Information technology,15.5,15.4,15.7,27,LP,880.2,-0.0313,-0.0828,0.1071,-0.2097,-0.3037,7041,Technology,260.0,"Norbit ASA provides technology products and solutions in Norway and internationally. The company offers monitoring and detection services for maritime, and offshore oil and gas projects; consultancy services; sensors and systems for monitoring, detection, and reporting tasks; and SeaCOP software system for monitoring, detection, and emergency response for maritime and offshore operations. Its products include DSRC 2G, a short range communication device; VTM 745, a DSRC module for enforcement in GNSS based tolling; connectivity modules for smart tachographs; desktop readers; road side units; and reclosable fasteners. In addition, the company is involved in the provision of electronic manufacturing services, such as pure circuit board assembly, cable and wire harness, and fabrication of products and systems; and original design manufacturing services under the NORBIT brand. Norbit ASA was founded in 1980 and is headquartered in Trondheim, Norway.",Trondheim,47 73 98 25 50,Norway,[],http://www.norbit.com,1.0,Stiklestadveien 1,Scientific & Technical Instruments,16.0,15.6,15.936541,0.01875,0.0,,15.6,,21087.0,,16.0,14.580882,0.3,15.6,,21087.0,,,,0.6,1588636800.0,,,,15.3,2.0,NOK,14108.0,,,,880196928.0,,,50853.0,1.3295002,15.3,15.65,,,14108.0,24.7,,,,12.6,15.5,False,0.0375,,15.6,OSL,NORBIT ASA,Norbit ASA,Europe/Oslo,CEST,False,7200000.0,EQUITY,NORBIT.OL,finmb_618424565,no_market,,1.423,,0.07274,8.787,-0.29670328,,,,56786900.0,,,7.886,,,,1577750400.0,0.14749,48155000.0,0.848,,,1.9655084999999999,0.54075,1640908800.0,1585612800.0,,,25260525.0,942145664.0,,,,,,-0.857,,,,,,,,https://logo.clearbit.com/norbit.com,,18.278301000000003,,,,,4640b786-3211-395e-b406-24cdb3c10b51,
NOM,Nordic Mining,Materials,2.33,2.3,2.33,104,,460.16,0.013,0.013,0.031,0.1092,0.1283,0250,Basic Materials,7.0,"Nordic Mining ASA, together with its subsidiaries, engages in the exploration, extraction, and production of industrial minerals and metals in Norway and internationally. The company primarily explores for rutile, garnet, quartz, lithium/lithium carbonate, and nickel deposits, as well as seabed massive sulfides and other seabed mineral deposits. Its flagship project is the EngebÃ¸ project located in the Naustdal in Sunnfjord municipality in Vestland county on the west coast of Norway. Nordic Mining ASA was founded in 2006 and is based in Oslo, Norway.",Oslo,47 22 94 77 90,Norway,[],http://www.nordicmining.com,1.0,Vika Atrium,Other Industrial Metals & Mining,2.3,2.3,2.0774817,,0.0,,2.35,,508803.0,,2.3,2.3858824,,2.3,,508803.0,,,,,,1.330813,,,2.28,4.0,NOK,434616.0,,,,460156352.0,,,1081037.0,,2.28,2.33,,8417800.0,434616.0,3.8,-12.944444,,,1.25,2.3,False,,27355300.0,2.35,OSL,NORDIC MINING ASA,Nordic Mining ASA,Europe/Oslo,CEST,False,7200000.0,EQUITY,NOM.OL,finmb_27206332,no_market,,,,0.0,-5.167000000000001,0.09642851,,,,197492000.0,,,0.9179999999999999,,,,1577750400.0,0.06196,-97241000.0,-0.616,,,2.5381262,0.19563,1640908800.0,1585612800.0,,,161222408.0,385515072.0,,1481155200.0,1:6,,,,,,,,,,,https://logo.clearbit.com/nordicmining.com,Entrance A 5th Floor Munkedamsveien 45,,47 22 94 77 91,,,,f23ff91d-2d02-3d64-be44-2a1aa0e4e9fe,
NANO,Nordic Nanovector,Health care,22.8,22.8,22.88,422,,1508.49,0.0009,0.0795,0.0565,-0.2817,-0.3853,0884,Healthcare,43.0,"Nordic Nanovector ASA, a biopharmaceutical company, develops and commercializes therapeutics for haematological cancers. The company's lead product candidate is Betalutin, an antibody-radionuclide-conjugate, which has completed Phase I/IIa clinical trial for the treatment of patients with non-hodgkin lymphoma, a life-threatening blood cancer. Nordic Nanovector ASA has collaboration agreements with Paul Scherrer Institute; Areva Med; LegoChemBio; and Heidelberg Pharma. The company was formerly known as Nordic Nanovector AS and changed its name to Nordic Nanovector ASA in 2014. Nordic Nanovector ASA was founded in 2009 and is headquartered in Oslo, Norway.",Oslo,47 22 18 33 01,Norway,[],http://www.nordicnanovector.com,1.0,Kjelsasveien 168 B,Biotechnology,22.78,22.8,19.849493,,0.0,,23.48,,324208.0,,22.78,20.902353,,22.8,,324208.0,,,,,,0.993604,,,22.54,2.0,NOK,343181.0,,,,1508491264.0,,,530532.0,,22.54,22.8,,10000.0,343181.0,40.0,-2.8643215,,,9.57,22.7,False,,100000.0,23.48,OSL,NORDIC NANOVECTOR,Nordic Nanovector ASA,Europe/Oslo,CEST,False,7200000.0,EQUITY,NANO.OL,finmb_117497706,no_market,,,,0.0,-2.391,,,-7.96,,66161900.0,,,4.362,,,,1577750400.0,0.24163,-435830016.0,-7.274,,,5.22696,0.14242,1640908800.0,1585612800.0,,,51454245.0,1126513792.0,,,,,,,,,,,,,,https://logo.clearbit.com/nordicnanovector.com,,,47 22 58 00 07,,,,00442fdb-da3e-3712-821e-59d32a59825e,
NOD,Nordic Semiconductor,Information technology,94.5,94.5,94.55,1266,,16793.87,0.0053,0.0565,0.2225,0.6966,1.2597,7052,Technology,822.0,"Nordic Semiconductor ASA, a fabless semiconductor company, designs, develops, and sells integrated circuits and related solutions for short and long range wireless communication in Europe, the Americas, and the Asia/Pacific. The company specializes in ultra-low power components, based on its proprietary 2.4 GHz RF, Bluetooth low energy, and LTE-M and NB- Internet of Things (IoT); and develops long power cellular IoT. It also provides Bluetooth 5 solutions; low power cellular devices for the IoT; and Bluetooth 5.1 solutions for direction finding applications. In addition, the company offers Zigbee 3.0 IoT solutions; Thread solution for low-power IEEE 802.15.4 devices; nRF52 and nRF51 series system-on-chips, and nRF5 software development kits; ANT, a proprietary ultra-low power wireless solution for battery operated products; and application specific integrated circuits and related consulting services. Further, it provides software for system development, communication stacks, and application layer software, as well as development tools for desktops, mobiles, and clouds. The company's products are used in various applications, such as audio and music, automotives, beacons, computer peripherals, connected health and homes, education, industrial automation, LED lightings, logistics and transport, retail and payment, sports and fitness, toys and gaming, virtual reality and augmented reality products, mobile phone accessories, and consumer electronics, as well as wearables, including connected watches, jewelry, proximity tags, and smart clothes and apparels. Nordic Semiconductor ASA was founded in 1983 and is headquartered in Trondheim, Norway.",Trondheim,47 72 89 89 00,Norway,[],http://www.nordicsemi.com,1.0,Otto Nielsens veg 12,Semiconductor Equipment & Materials,94.0,94.6,61.507298,,0.0,,95.2,,335939.0,,94.0,80.72794,,94.6,,335939.0,,,,,1308268800.0,1.402325,,,92.25,2.0,NOK,365894.0,,,,16793877504.0,,,483865.0,51.834236,92.25,89.9,,96500.0,365894.0,95.2,1181.25,,,31.48,94.55,False,,581300.0,95.2,OSL,NORDIC SEMICONDUCT,Nordic Semiconductor ASA,Europe/Oslo,CEST,False,7200000.0,EQUITY,NOD.OL,finmb_884166,no_market,,51.02,,0.04478,584.188,1.3499999,,0.08,,177712992.0,,,1.371,,,,1577750400.0,0.55627996,14507000.0,0.083,,,68.92779,0.13182001,1640908800.0,1593475200.0,,,171036252.0,16530178048.0,,,,,,0.5,,,,,,,,https://logo.clearbit.com/nordicsemi.com,,1138.5542,,,,,61ea7640-f972-397d-be57-4173fa2df326,
