PLT,poLight,Information technology,77.0,76.8,77.0,121,LP,696.57,0.0132,0.065,0.3322,0.972,5.2341,3188,Technology,21.0,"poLight ASA develops photographic lens for consumer devices and industrial applications. Its lens replicates the lens of the human eye enabling the implementation of autofocus functions for various applications. The company's product portfolio includes Tunable Optical Lens (TLens) products for front and back camera phones; wearables, including AR/VR devices; tablet PCs; HD video cameras; drones; handheld devices; and barcode readers, as well for industry applications, such as medical and retail. It also offers ASIC drivers that control the supply of variable voltage to TLens products and makes them to change focus. It has operations in Europe, Asia, and the United States. poLight ASA was founded in 2005 and is headquartered in Horten, Norway.",Horten,47 33 07 12 60,Norway,[],http://polight.com,1.0,Kongeveien 77,Electronic Components,76.0,77.6,61.313572,,0.0,,77.8,,32113.0,,76.0,62.317645999999996,,77.6,,32113.0,,,,,,,,,76.2,2.0,NOK,22444.0,,,,696570496.0,,,36828.0,199.36191000000002,76.2,77.0,,0.0,22444.0,95.0,,,,6.6,76.8,False,,0.0,77.8,OSL,POLIGHT ASA,poLight ASA,Europe/Oslo,CEST,False,7200000.0,EQUITY,PLT.OL,finmb_39950814,no_market,,162.776,,0.0,-9.177999999999999,5.6666669999999995,,,,9046370.0,,,13.582,,,,1577750400.0,0.50662,-82413000.0,-10.154,,,5.669268,0.115959994,1640908800.0,1585612800.0,,,4214463.0,568740800.0,,,,,,,,,,,,,,https://logo.clearbit.com/polight.com,,,,,,,046cac0f-3777-35a9-8f0e-7c36293edb39,
PRS,Prosafe,Energy,1.44,1.4,1.45,20,,118.21,-0.0177,0.031400000000000004,0.03,-0.3158,-0.868,4031,Energy,150.0,"Prosafe SE, together with its subsidiaries, owns and operates semi-submersible accommodation vessels in Europe, South America, and internationally. Its accommodation vessels are used for accommodation, engineering, construction, or storage capacity offshore. The company is also involved in the maintenance and modification of installations on fields for the production, hook-up and commissioning of new fields, tie-backs to existing infrastructure, and decommissioning activities. It owns and operates a fleet of seven semi-submersible accommodation vessels and one tender support vessel. The company primarily serves oil and gas industries. Prosafe SE was founded in 1972 and is based in Stavanger, Norway.",Stavanger,47 51 64 25 00,Norway,[],http://www.prosafe.com,1.0,Forusparken 2,Oil & Gas Equipment & Services,1.47,1.4680000000000002,1.7027773999999998,,0.0,,1.4680000000000002,,107095.0,,1.47,1.4635882,,1.4680000000000002,,107095.0,,,,,1440633600.0,1.289534,,,1.402,4.0,NOK,32420.0,,,,118211904.0,,,170427.0,0.64631987,1.402,1.4480000000000002,,3800000.0,32420.0,11.002,-1.52,,,1.0,1.4,False,,4412500.0,1.4680000000000002,OSL,PROSAFE SE (SN),Prosafe SE,Europe/Oslo,CEST,False,7200000.0,EQUITY,PRS.OL,finmb_6522039,no_market,,7.471,,0.0,18.245,-0.86132073,,-0.95,,81864200.0,,,-9.763,,,,1577750400.0,0.4341,-1226800000.0,-13.949000000000002,,,,0.20045,1640908800.0,1585612800.0,,,68411519.0,1366520704.0,,1480982400.0,1:100,,,,,,,,,,,https://logo.clearbit.com/prosafe.com,,,,,,,fab88977-73e3-30c8-ba4f-4246afb217d5,
PROTCT,Protector Forsikring,Financials,44.95,44.6,44.95,107,,3680.79,0.0181,0.0045000000000000005,0.0754,-0.14300000000000002,-0.0513,0250,Financial Services,384.0,"Protector Forsikring ASA, a general insurance company, provides various insurance products to the commercial and public sectors, and the affinity insurance markets in Norway, Sweden, Denmark, the United Kingdom, and Finland. The company sells its products to non-marine industries through insurance brokers, and real estate agents and lawyers. Protector Forsikring ASA was founded in 2003 and is based in Oslo, Norway.",Oslo,47 24 13 17 00,Norway,[],http://www.protectorforsikring.no,1.0,Stoperigata 2,Insurance—Specialty,44.15,45.8,36.390507,0.050962627,0.0,,45.8,,41155.0,,44.15,42.388573,2.25,45.8,,41155.0,,,,,1492732800.0,1.296511,,,44.55,2.0,NOK,114870.0,,,,3680784640.0,,,77878.0,0.7649383000000001,44.55,45.45,,7400.0,114870.0,55.75,10.123874,,,20.02,44.65,False,,189600.0,45.8,OSL,PROTECTOR FORS ASA,Protector Forsikring ASA,Europe/Oslo,CEST,False,7200000.0,EQUITY,PROTCT.OL,finmb_20644228,no_market,,0.953,,0.0458,14.561,-0.058635414000000004,,4.44,,81886200.0,,,27.256,,,,1577750400.0,0.22303,214120992.0,2.6860000000000004,,,1.6491781000000003,0.30537,1640908800.0,1593475200.0,,,65712880.0,4584376832.0,,,,,,,,,,,,,,https://logo.clearbit.com/protectorforsikring.no,,16.734920000000002,,,,,ac391ae3-e333-359c-85de-0c566a1ff879,
QFR,Q-Free,Information technology,4.86,4.86,4.92,13,,433.63,-0.016200000000000003,-0.028,0.0946,-0.2853,-0.2523,7053,Industrials,380.0,"Q-Free ASA supplies intelligent transportation system products and solutions worldwide. The company offers tolling products, such as dedicated short-range communication tags and readers, parking access control software and image based solutions, and electronic toll collection systems; parking guidance and parking access control systems; traffic, bicycle, and pedestrian detection and counting products, as well as weigh in motion, journey time monitoring, and weather and air-quality monitoring systems; local intersection/traffic controllers, and centralized traffic controller SW and cooperative ITS solutions; and advanced traffic management, traffic information, ramp metering, and truck parking products. It also provides service and maintenance services. The company was formerly known as Micro Design AS and changed its name to Q-Free ASA in 1998. Q-Free ASA was founded in 1984 and is headquartered in Trondheim, Norway.",Trondheim,47 73 82 65 00,Norway,[],http://www.q-free.com,1.0,Strindfjordvegen 1,Infrastructure Operations,4.94,4.9,4.8678102,,0.0,,4.92,,29074.0,,4.94,4.6861763,,4.9,,29074.0,,,,,,0.7802319999999999,,,4.86,4.0,NOK,5404.0,,,,433625728.0,,,159156.0,0.47515836,4.86,4.88,,,5404.0,7.3,,,,3.34,4.86,False,,,4.92,OSL,Q-FREE ASA,Q-Free ASA,Europe/Oslo,CEST,False,7200000.0,EQUITY,QFR.OL,finmb_1779941,no_market,,0.752,,-0.0502,96.979,-0.22812498,,,,89223400.0,,,4.5889999999999995,,,,1577750400.0,0.24962999,-45809000.0,-0.521,,,1.0590543,0.46799999999999997,1640908800.0,1593475200.0,,,64542450.0,686511360.0,,,,,,,,,,,,,,https://logo.clearbit.com/q-free.com,Ranheim,,,,,,bfc0f428-0ab8-3f1b-be51-912e13d9bbc5,
QFUEL-ME,Quantafuel,Industrials,22.9,22.8,22.9,134,,2877.7,0.0292,-0.0214,-0.0297,,,0283,Industrials,25.0,"Quantafuel AS, a technology-based energy company, which converts plastic waste to environment friendly fuels and chemicals in Norway. The company was founded in 2014 and headquartered in Oslo, Norway.",Oslo,,Norway,[],http://www.quantafuel.com,1.0,Lilleakerveien 2C,Waste Management,22.25,22.25,126.6642,,0.0,,23.3,,99958.0,,22.25,61.844559999999994,,22.25,,99958.0,,,,,,1.281549,,,22.25,2.0,NOK,158505.0,,,,2877705472.0,,,63188.0,5790.151999999999,22.25,22.9,,,158505.0,275.0,,,,20.05,22.8,False,,,23.3,OSL,QUANTAFUEL ASA,Quantafuel AS,Europe/Oslo,CEST,False,7200000.0,EQUITY,QFUEL-ME.OL,finmb_418823774,no_market,,5358.866,,0.0,-128.2,inf,,,,125664000.0,,,1.609,,,,1577750400.0,0.15267,-131388000.0,-1.175,,,14.232443,0.0,1640908800.0,1585612800.0,,,78121552.0,2663356416.0,,1594080000.0,10:1,,,,,,,,,,,https://logo.clearbit.com/quantafuel.com,,,,,,,72697af9-d52b-391e-b44d-8c49e18179e0,
QEC,Questerre Energy Corporation,Energy,0.8,0.76,0.8,68,,340.19,0.0127,-0.0063,-0.0966,-0.4735,-0.4628,T2P 3W2,Energy,8.0,"Questerre Energy Corporation acquires, explores, and develops non-conventional oil and gas projects in Canada. It produces tight oil, oil shale, shale oil, and shale gas. The company primarily holds 40,800 acres located in Kakwa, west central Alberta, including a 25% working interest in 10,080 acres in Kakwa Central; 50% working interest in 4,480 acres in Kakwa North; 50% interest in 22,400 acres in Kakwa West; and 50% interest in 3,840 acres in Kakwa South. It also holds 100% working interest in 11,952 acres located in Antler, Saskatchewan; and oil shale assets in Jordan. The company was formerly known as Westpro Equipment Ltd. and changed its name to Questerre Energy Corporation in December 2000. Questerre Energy Corporation was incorporated in 1971 and is headquartered in Calgary, Canada.",Calgary,403 777 1185,Canada,[],http://www.questerre.com,1.0,801 - Sixth Avenue S.W.,Oil & Gas E&P,0.785,0.79,1.0270401,,0.0,,0.8,,437507.0,,0.785,0.87611765,,0.79,,437507.0,,,,,,2.372008,,,0.76,4.0,NOK,671603.0,,,,323801920.0,,,921294.0,,0.76,0.79,,3250500.0,671603.0,1.96,4.96875,,,0.65,0.76,False,,10000000.0,0.8,OSL,QUESTERRE ENERGY,Questerre Energy Corporation,Europe/Oslo,CEST,False,7200000.0,EQUITY,QEC.OL,finmb_6371783,no_market,,,,-1.53236,,-0.45104890000000003,,0.16,,427516000.0,,,0.332,,,,1577750400.0,0.10503,,-0.038,,,2.3945785,0.043870002000000005,1640908800.0,1585612800.0,,,411287493.0,335600064.0,,,,,,,,,,,,,,https://logo.clearbit.com/questerre.com,Suite 1650,,403 777 1578,,,,3490e3e5-e6d7-39f2-bdcb-198897169bd0,AB
RAKP,RAK Petroleum,Energy,6.44,6.14,6.44,5,,1252.25,0.052300000000000006,0.0489,0.0063,-0.4472,-0.4678,KT13 0TS,Energy,1325.0,"RAK Petroleum plc operates as an oil and gas investment company. It primarily holds 44.94% interests in DNO ASA through which it owns 106 licenses comprises three licenses in the Kurdistan Region of Iraq, 87 licenses in Norway, 12 licenses in the United Kingdom, two licenses in the Netherlands, one license in Ireland, and one license in Yemen. The company also holds 33.33% interest in Foxtrot International LDC, which operates offshore Block CI-27 comprising four producing gas fields with associated oil and condensates in Foxtrot and Mahi; and Block CI-502 and Block CI-12 offshore exploration licenses. RAK Petroleum plc was founded in 2005 and is based in Weybridge, the United Kingdom.",Weybridge,44 9712 356 662,United Kingdom,[],http://www.rakpetroleum.uk,1.0,Elder House,Oil & Gas E&P,6.12,6.5,6.551387,,0.0,,6.5,,78955.0,,6.12,6.45,,6.5,,78955.0,,,,,,1.686046,,,6.44,2.0,NOK,420.0,,,,3229363968.0,,,46640.0,3.324443,6.44,6.44,,338500.0,420.0,13.4,,,,3.11,6.14,False,,325400.0,6.5,OSL,RAK PETROLEUM PLC,RAK Petroleum plc,Europe/Oslo,CEST,False,7200000.0,EQUITY,RAKP.OL,finmb_25838857,no_market,,3.111,,0.033350002000000004,5.3229999999999995,-0.47692305,,,,178598000.0,,,2.803,,,,1577750400.0,0.088240005,32400000.0,0.10800000000000001,,,2.2975383,0.48634997,1640908800.0,1577750400.0,,,168012427.0,3022143488.0,,,,,,,,,,,,,,https://logo.clearbit.com/rakpetroleum.uk,St Georges Business Park Brooklands Road,59.629627,,,,,1daba114-11e3-37ba-beb2-e131e0da5042,
REACH,Reach Subsea,Energy,1.09,1.05,1.11,12,,156.46,0.0187,-0.0091,0.0093,-0.3123,-0.4785,5527,Energy,88.0,"Reach Subsea ASA provides subsea services in Norway. The company offers inspection, maintenance, and repair services; and remotely operated vehicles, survey, and construction services. It provides engineering services to the oil industry. The company was formerly known as Transit Invest ASA and changed its name to Reach Subsea ASA in December 2012. Reach Subsea ASA was founded in 2008 and is based in Haugesund, Norway.",Haugesund,47 40 00 77 10,Norway,[],http://www.reachsubsea.no,1.0,Garpeskjarveien 2,Oil & Gas Equipment & Services,1.07,1.04,1.1535474,0.06542056,,,1.11,,20373.0,,1.07,1.0961764999999999,0.07,1.04,,20373.0,,,,0.07,1559001600.0,1.155813,,,1.04,4.0,NOK,40034.0,,,,156464048.0,,,126241.0,0.3009283,1.04,1.08,,2197000.0,40034.0,2.1,10.900001,,,0.7,1.05,False,0.0583,2000000.0,1.11,OSL,REACH SUBSEA ASA,Reach Subsea ASA,Europe/Oslo,CEST,False,7200000.0,EQUITY,REACH.OL,finmb_878070,no_market,,0.589,,-0.09323,256.388,-0.47549015,,0.1,,143544992.0,,,0.9390000000000001,,,,1577750400.0,0.09521,-48476000.0,-0.337,,,1.1608094,0.63115,1640908800.0,1585612800.0,,,54092442.0,306127232.0,,1354752000.0,1:20,,,,,,,,,,,https://logo.clearbit.com/reachsubsea.no,,,,,,,1064989a-bdc9-3a76-b6b6-0ace25a01623,
REC,REC Silicon,Information technology,3.3,3.3,3.32,642,,923.4,-0.049,-0.0096,0.1066,0.2323,-0.3376,1324,Technology,284.0,"REC Silicon ASA, together with its subsidiaries, produces and sells silicon materials for the solar and electronics industries worldwide. It offers various solar grade polysilicon for solar applications, including granular polysilicon, Siemens rod sections, chunks, chips, and fines. The company also provides electronic grade polysilicon comprising TearDrop, as-grown Siemens rods, rod sections, chunks, and chips for use in Czochralski monocrystalline ingot/wafer manufacturing for the semiconductor industry, as well as other electronic market segments, such as optics and microelectromechanical systems; and float zone polysilicon. In addition, it offers silicon gases consisting of silane, dichlorosilane, monochlorosilane, disilane, and polysilanes. The company was formerly known as Renewable Energy Corporation ASA and changed its name to REC Silicon ASA in October 2013. REC Silicon ASA was founded in 1996 and is headquartered in Lysaker, Norway.",Lysaker,47 40 72 40 86,Norway,[],http://www.recsilicon.com,1.0,Fornebuveien 84,Semiconductor Equipment & Materials,3.47,3.522,3.409321,,0.0,,3.522,,3573647.0,,3.47,3.1035294999999996,,3.522,,3573647.0,,,,,,1.1918600000000001,,,3.2760000000000002,4.0,NOK,4275866.0,,,,923406016.0,,,4416842.0,6.600472,3.2760000000000002,3.324,,1240000.0,4275866.0,6.0,,,,1.9709999999999999,3.302,False,,2100000.0,3.522,OSL,REC SILICON ASA,REC Silicon ASA,Europe/Oslo,CEST,False,7200000.0,EQUITY,REC.OL,finmb_6245251,no_market,,7.544,,-0.81558,-109.935,-0.26947367,,0.0,,279820000.0,,,-0.037000000000000005,,,,1577750400.0,0.17794001,-114100000.0,-0.42100000000000004,,,,0.25069,1640908800.0,1585612800.0,,,261982875.0,1055374976.0,,1562889600.0,1:10,,,,,,,,,,,https://logo.clearbit.com/recsilicon.com,PO Box 63,,,,,,621ea196-4385-32e4-adc0-c5122866984b,
RIVER-ME,River iGaming,Consumer discretionary,6.95,5.95,6.8,1,,132.17,0.0221,,0.2523,-0.5656,,,,,,,,,,,,,,,,,,,,,,,,,,,,,,,,,,,,,,,,,,,,,,,,,,,,,,,,,,,,,,,,,,,,,,,,,,,,,,,,,,,,,,,,,,,,,,,,,,,,,,,,,,,,,,,,,,,,,,,,,,,,,,,
ROM,RomReal,Real estate,1.91,1.95,1.98,1,,78.92,0.0053,-0.0905,-0.2298,-0.1696,-0.2421,HM 11,Real Estate,5.0,"RomReal Limited, together with its subsidiaries, engages in property investment and development in Romania. The company owns a portfolio of properties, primarily in Constanta and Ovidiu. Its plots are primarily suited for residential and commercial developments. As of December 31, 2019, the company's land bank comprised 275,835 square meters. RomReal Limited was founded in 2005 and is based in Hamilton, Bermuda.",Hamilton,441 400 6000,Bermuda,[],http://www.romreal.com,1.0,Burnaby Building,Real Estate Services,1.9,1.91,2.049051,,0.0,,1.91,,27716.0,,1.9,2.2991175999999998,,1.91,,27716.0,,,,,,-0.011045999999999999,,,1.91,4.0,NOK,300.0,,,,79012496.0,,,5599.0,,1.91,1.98,,123900.0,300.0,2.98,,,,1.3,1.95,False,,900000.0,1.91,OSL,ROMREAL INVEST LTD,RomReal Limited,Europe/Oslo,CEST,False,7200000.0,EQUITY,ROM.OL,finmb_34051402,no_market,,,,0.0,,-0.24603176,,,,41367800.0,,,0.574,,,,1577750400.0,0.03263,,0.040999999999999995,,,3.327526,0.52756,1640908800.0,1585612800.0,,,8654554.0,78598784.0,,,,,,,,,,,,,,https://logo.clearbit.com/romreal.com,16 Burnaby street,46.585365,,,,,2574fb2a-334d-3d61-9b67-1939877496d8,
ROMSB-ME,Romsdal Sparebank,Equity certificates,115.0,114.1,121.0,0,LP,225.94,,,0.0268,,,6440,Financial Services,,"Romsdal Sparebank operates as a savings bank that provides various financial products and services to retail and corporate customers primarily in Romsdal and southern parts of NordmÃ¸re. Its personal banking products and services include BSU and other savings accounts, fund savings plans, and retirement savings plans; bank cards and payment solutions; and mortgages, car and other vehicle loans, and small loans and refinancing. The company's business banking products and services comprise corporate accounts; financing solutions, such as bank guarantees, construction loans, overdrafts, leasing, and corporate loans; and savings and pension plans. It also offers debit and credit cards, payment solutions, Internet and mobile banking services, and insurance agency services. Romsdal Sparebank was formerly known as Bud FrÃ¦na og Hustad Sparebank and changed its name to Romsdal Sparebank in January 2018. The company was incorporated in 1971 and is based in ElnesvÃ¥gen, Norway with branch offices in Bud, EidsvÃ¥g, Farstad, and Molde, Norway.",Elnesvagen,47 71 26 80 00,Norway,[],http://romsdalsbanken.no,1.0,Torget 14,Financial Conglomerates,115.0,115.0,111.268654,0.07200000000000001,0.0,,115.0,,18.0,,115.0,113.617645,8.28,115.0,,18.0,,,,,,,,,115.0,2.0,NOK,4.0,,,,225940496.0,,,98.0,1.6619138,115.0,121.0,,,4.0,119.0,,,,102.0,114.0,False,,,115.0,OSL,ROMSDAL SPAREBANK,Romsdal Sparebank,Europe/Oslo,CEST,False,7200000.0,EQUITY,ROMSB-ME.OL,finmb_32489035,no_market,,10.146,,0.29304,,inf,,,,1964700.0,,,373.64300000000003,,,,1577750400.0,,9576000.0,4.874,,,0.3077804,,1640908800.0,1585612800.0,,,,1379411456.0,,,,,,-0.124,,,,,,,,https://logo.clearbit.com/romsdalsbanken.no,,23.594584,47 71 26 80 01,,,,79804c60-17fd-3d3e-b5b5-988dd06cf2f5,
SDSD,S.D. Standard Drilling,Energy,0.75,0.75,0.76,43,,433.17,0.008,0.0108,0.019,-0.443,-0.3681,3030,Energy,2.0,"S.D. Standard Drilling Plc operates the in oil and gas, and shipping sectors. It owns a 100% interest in four large-size platform supply vessels (PSVs); and a 26% interest in nine mid-size PSVs. The company was founded in 2010 and is headquartered in Limassol, Cyprus.",Limassol,357 2 5875474,Cyprus,[],http://www.standard-drilling.com,1.0,Panayides Building,Oil & Gas Equipment & Services,0.746,0.752,0.8451752,0.0,0.0,,0.758,,712987.0,,0.746,0.75411767,0.0,0.752,,712987.0,,,,,1446163200.0,0.728488,,,0.742,4.0,NOK,260425.0,,,,433171520.0,,,787525.0,-83.46271999999999,0.742,0.752,,246300.0,260425.0,1.41,37.6,,,0.68,0.748,False,,1200000.0,0.758,OSL,S.D. STANDARD DRIL,S.D. Standard Drilling Plc,Europe/Oslo,CEST,False,7200000.0,EQUITY,SDSD.OL,finmb_117207561,no_market,,-81.64399999999999,,0.0,,-0.34847164,,0.02,,576025984.0,,,0.18600000000000003,,,,1577750400.0,0.20236999,-7025000.0,-0.012,,,4.0430107,0.68294996,1640908800.0,1585612800.0,,,284320673.0,423730400.0,,1493942400.0,1:3,,,,,,,,,,,https://logo.clearbit.com/standard-drilling.com,2nd floor Flat/Office 3 Chrysanthou Mylona 1,,,,,,c402d990-30ec-3132-96d5-67784a88888a,
SAGA,Saga Tankers,Financials,0.94,0.9,0.94,14,,250.18,0.0444,0.0053,0.0444,-0.126,-0.0178,0278,Industrials,6.0,"Saga Tankers ASA engages in the investment, management, and consultancy activities related to shipping, rig, real estate, stock trading, and other related businesses. It operates through Investments, Vallhall, and Other segment. The company invests in financial assets of long and short term; rents and operates vallhall facility; and offers professional services. Saga Tankers ASA was incorporated in 2010 and is headquartered in Oslo, Norway.",Oslo,47 23 01 49 14,Norway,[],http://www.sagatankers.no,1.0,Sjolystplass 2,Marine Shipping,0.9,0.95,0.89861315,0.11111112,0.0,,0.955,,32394.0,,0.9,0.94308823,0.1,0.95,,32394.0,,,,0.1,1592352000.0,0.647093,,,0.94,4.0,NOK,60358.0,,,,250180992.0,,,148410.0,4.5678472999999995,0.94,0.94,,607200.0,60358.0,1.25,,,,0.62,0.905,False,0.1075,1000000.0,0.955,OSL,SAGA TANKERS ASA,Saga Tankers ASA,Europe/Oslo,CEST,False,7200000.0,EQUITY,SAGA.OL,finmb_104481471,no_market,,3.7260000000000004,,-1.3173399,6.4110000000000005,-0.15887856,,,,266150000.0,,,0.9420000000000001,,,,1577750400.0,0.06307,-72151000.0,-0.27399999999999997,,,0.9978769000000001,0.84233004,1640908800.0,1585612800.0,,,28262451.0,204090848.0,,,,,,,,,,,,,,https://logo.clearbit.com/sagatankers.no,,,,,,,67fbca9a-e66f-3722-a9c2-d56fd1816a50,
SALM,SalMar,Consumer staples,450.9,450.9,451.0,2175,,50916.92,0.008,0.0557,-0.006,0.0036,0.1054,,,,,,,,,,,,,,,,,,,,,,,,,,,,,,,,,,,,,,,,,,,,,,,,,,,,,,,,,,,,,,,,,,,,,,,,,,,,,,,,,,,,,,,,,,,,,,,,,,,,,,,,,,,,,,,,,,,,,,,,,,,,,,
SALMON,Salmones Camanchaca,Consumer staples,57.8,57.4,57.8,3,,3814.8,0.006999999999999999,-0.0034,0.0471,-0.1008,-0.0676,7550000,Consumer Defensive,1755.0,"Salmones Camanchaca S.A. engages in the salmon farming business in Chile. It offers fresh and frozen Atlantic and Pacific salmon in various formats, such as whole, fillet, portion, block, and harasu; and trout. The company operates under the Camanchaca Gourmet and Pier 33 brandsIt also exports its products to the United States, Russia, Brazil, China, Mexico, Japan, Argentina, and internationally. The company was founded in 2009 and is headquartered in Santiago, Chile. Salmones Camanchaca S.A. is a subsidiary of CompaÃ±Ã­a Pesquera Camanchaca S.A.",Santiago,56 22 363 5700,Chile,[],http://www.salmonescamanchaca.cl,1.0,Avenida El Golf NÂ° 99,Farm Products,57.4,58.0,60.220436,0.0044425083,0.7757,,58.0,,388.0,,57.4,55.441177,0.255,58.0,,388.0,,,,2.63,1588636800.0,0.787929,,,57.8,2.0,NOK,490.0,,,,3874940928.0,,,1772.0,11.125904,57.8,57.8,,0.0,490.0,75.0,,,,40.0,56.6,False,0.045300003,0.0,58.0,OSL,SALMONES CAMANCHAC,Salmones Camanchaca S.A.,Europe/Oslo,CEST,False,7200000.0,EQUITY,SALMON.OL,finmb_128615902,no_market,,11.11,,0.08799,56.059,-0.07717043,,,,66000000.0,,,3.042,,,,1577750400.0,0.32634997,30645000.0,0.46399999999999997,,,19.000656,0.7438899999999999,1640908800.0,1585612800.0,,,19800000.0,3869453056.0,,,,,,-0.865,,,,,,,,https://logo.clearbit.com/salmonescamanchaca.cl,Piso 10 Las Condes,124.56897,56 22 375 4384,,,,22f0e8a2-c696-3735-8edb-39400d62d7e2,
SADG,Sandnes Sparebank,Equity certificates,59.8,59.6,59.8,13,,1251.03,0.0034,0.0136,0.017,-0.0208,0.0332,4306,Financial Services,133.0,"Sandnes Sparebank, an independent savings bank, provides a range of banking and investment products to retail and corporate customers in Norway. The company operates through three segments: Retail Market, Corporate Market, and Real Estate Agency. It offers fixed rate deposits, deposit accounts, BSU, escrow accounts for tax withholding, and other accounts; various loans and guarantees; and mobile and internet banking services. The company also provides real estate brokerage and general investment advisory services. Sandnes Sparebank was founded in 1875 and is headquartered in Sandnes, Norway.",Sandnes,47 51 67 67 00,Norway,[],http://www.sandnes-sparebank.no,1.0,Radhusgata 3,Banks—Regional,59.6,60.0,60.586859999999994,0.08389262,0.6849,,60.0,,5847.0,,59.6,58.388237,5.0,60.0,,5847.0,,,,5.0,1585699200.0,0.5156970000000001,,,59.6,2.0,NOK,2625.0,,,,1251033984.0,,,6812.0,2.1915436,59.6,59.8,,150000.0,2625.0,78.0,9.917081,,,50.0,59.6,False,0.083900005,100000.0,60.0,OSL,SANDNES SPAREBANK,Sandnes Sparebank,Europe/Oslo,CEST,False,7200000.0,EQUITY,SADG.OL,finmb_7009157,no_market,,17.961,,0.44356999999999996,,-0.05396825,,6.03,,20920300.0,,,130.786,,,,1577750400.0,0.25989,165028992.0,7.369,,,0.45723549999999996,0.21443,1640908800.0,1585612800.0,,,10346965.0,10253096960.0,,,,,,-0.42200000000000004,,,,,,,,https://logo.clearbit.com/sandnes-sparebank.no,,8.115077000000001,,,,,c56ac015-82e6-3bc7-8716-b1cd496f79ed,
SAS NOK,SAS AB,Industrials,8.21,8.15,8.26,102,,3139.09,0.013,-0.0103,0.0231,-0.431,-0.3362,,,,,,,,,,,,,,,,,,,,,,,,,,,,,,,,,,,,,,,,,,,,,,,,,,,,,,,,,,,,,,,,,,,,,,,,,,,,,,,,,,,,,,,,,,,,,,,,,,,,,,,,,,,,,,,,,,,,,,,,,,,,,,
SATS,SATS,Consumer discretionary,20.0,20.0,20.05,148,,3435.27,-0.0172,-0.0196,0.0267,-0.118,,,,,,,,,,,,,,,,,,,,,,,,,,,,,,,,,,,,,,,,,,,,,,,,,,,,,,,,,,,,,,,,,,,,,,,,,,,,,,,,,,,,,,,,,,,,,,,,,,,,,,,,,,,,,,,,,,,,,,,,,,,,,,,
SBANK,Sbanken,Financials,66.0,65.3,66.0,257,,7053.38,-0.012,0.0061,0.041,-0.1153,-0.0179,,Financial Services,338.0,"Sbanken ASA, a digital bank, provides various banking products to retail customers in Norway. The company offers deposit products, such as security deposit accounts and home savings account; and home loans, car loans, credit cards, overdraft facilities, personal loans, consumer loans, and custody account loans, as well as short-term loans. It also provides payment services, including payment of bills, international payments, invoice payments, card transactions, etc.; log-in, security solutions, etc.; and investment products, as well as online banking services. The company was formerly known as Skandiabanken ASA and changed its name to Sbanken ASA in November 2017. Sbanken ASA was founded in 2000 and is headquartered in Bergen, Norway.",Bergen,47 55 26 00 00,Norway,[],http://sbanken.no,1.0,Folke Bernadottesvei 38,Banks—Regional,66.8,66.9,60.426643000000006,0.026197603,0.0,,67.5,,46439.0,,66.8,64.45,1.75,66.9,,46439.0,,,,,1587945600.0,1.097117,,,65.1,2.0,NOK,47504.0,,,,7048271872.0,,,130958.0,4.1306686,65.1,65.8,,0.0,47504.0,77.6,9.053498,,,38.5,65.4,False,,0.0,67.5,OSL,SBANKEN ASA,Sbanken ASA,Europe/Oslo,CEST,False,7200000.0,EQUITY,SBANK.OL,finmb_215678890,no_market,,14.011,,0.4069,,0.0030031204,,7.29,,106792000.0,,,69.237,,,,1577750400.0,0.8619600000000001,694308992.0,6.497000000000001,,,0.95324755,0.0,1640908800.0,1593475200.0,,,78567128.0,23907196928.0,,,,,,0.048,,,,,,,,https://logo.clearbit.com/sbanken.no,,10.158534,,,,,d2bc4800-932a-3817-b298-6e2d130d91bc,
